영화 ID,제목,원제,개봉일,줄거리,장르,국가,제작사,포스터 URL,러닝타임,평점,투표수,인기도,감독,주연
741315,청춘선거,청춘선거,2021-06-17,"아무런 정치 경험이 없는 30대 이주민 여성 고은영이 2018년 제주도 지방선거에 도지사 후보로 출마한다. 좌충우돌 선거 운동 과정은 거기 참여한 고은영과 동료들의 마음을 움직이고 변화시킨다. 무엇보다, 그들의 외침이 유권자들에게 뜻밖의 바람을 일으키면서, 고은영과 동료들은 새로운 자기 모습을 발견하기 시작한다.",다큐멘터리,South Korea,eye m,https://image.tmdb.org/t/p/w500/oNv1S0Gj08nPCCRSSimgUSjb6BF.jpg,99,0.0,0,0.2535,Min Hwan-ki,
602288,여고괴담 여섯번째 이야기: 모교,여고괴담 여섯번째 이야기: 모교,2021-06-17,"은희가 교감으로 부임한 모교의 폐쇄된 화장실에서 기이한 사건사고가 연이어 발생한다. 폐쇄된 화장실을 아지트로 사용하던 여고생 하영과 소연은 아무도 없는 화장실에서 울려 퍼지는 허밍을 듣고, 귀신의 존재를 믿게 된다. 우연히 발견한 화분을 단서로 이 미스터리에 은희가 연관됐다고 추측하는 하영. 부임 후 환영과 환청으로 불안과 두려움에 떨고 있던 은희 또한 화장실 거울 속에서 흉측한 모습의 여고생을 목격하고 자신을 모교로 불러들인 것이 그 소녀라고 확신하고 그 정체를 밝히려고 하는데...","공포, 미스터리",South Korea,"Cine2000, kth",https://image.tmdb.org/t/p/w500/r3L1l11oYl1kXTq5Lgvc56HSqAe.jpg,108,6.779,34,2.4732,Lee Mi-young,"김서형, 김현수, 최리, 비비"
987925,너를 위해 문을 열어 놓을게,너를 위해 문을 열어 놓을게,2021-06-21,,판타지,South Korea,Samsung Electronics,https://image.tmdb.org/t/p/w500/yzsgXgB3Zvc4gJMLLgcO0i142rs.jpg,5,6.0,1,0.6392,이옥섭,"김향기, 구교환"
853383,섹스인형 : 그녀의 온도,섹스인형 : 그녀의 온도,2021-06-21,,드라마,South Korea,,https://image.tmdb.org/t/p/w500/8KEs81EJaDSqWen6KGdi6Pca29s.jpg,71,4.0,1,0.8855,Kim Dong-gi,"Yoon Yool, Min Ah, 조완진, Shin Yeon-ho"
804523,아홉 살의 사루비아,아홉 살의 사루비아,2021-06-22,,애니메이션,South Korea,,https://image.tmdb.org/t/p/w500/lEdWycF4Z7jZLylBHFQfBZ0bdKG.jpg,7,0.0,0,0.0168,Nari Jang,
844510,클리타임네스트라,Clytaemnestra,2021-06-23,,드라마,"South Korea, United States of America",,https://image.tmdb.org/t/p/w500/hXtJX5wF8UYalvj5tZPYUG2YA7I.jpg,70,6.5,2,0.1494,Ougie Pak,"Haru Kim, Kim Jong-man"
762568,메이드 인 루프탑,메이드 인 루프탑,2021-06-23,"연인인 정민과 헤어지고 갈 데가 없어진 취준생 하늘은, 옥탑방에 사는 절친 봉식의 집에 얹혀살게 된다. 하이텐션+1인 방송 컨셉의 BJ로 일하는 봉식은 매력적인 직진남 민호로부터 구애를 받지만, 왠지 모르게 머뭇거리기만 한다. 하늘과 정민은 화해를 시도해 보지만 어긋나기만 하고, 의도치 않게 상처만 준다. 어느 날 정민이 교통사고를 당하고 하늘은 같이 키우던 고양이 아리를 데려와야 하는데……","드라마, 로맨스, 코미디",South Korea,Atnine Film,https://image.tmdb.org/t/p/w500/wsNITQPoUws8m8ZXuj16Za00c7B.jpg,86,7.0,3,0.692,김조광수,"이홍내, 정휘, 이정은, Kang Jeong-woo"
654739,발신제한,발신제한,2021-06-23,"은행센터장 성규는 아이들을 차에 태우고 출발한 평범한 출근길에 한 통의 발신번호 표시제한 전화를 받는다. 전화기 너머 의문의 목소리는 차에 폭탄이 설치되어 있고, 자리에서 일어날 경우 폭탄이 터진다고 경고한다. 대수롭지 않게 여기던 성규는 곧 동료의 차가 폭파되는 것을 바로 눈앞에서 목격하고, 졸지에 부산 도심 테러의 용의자가 되어 경찰의 추격을 받게 되는데…","액션, 범죄, 드라마, 스릴러",South Korea,"CJ Entertainment, TPS Company, CJ ENM",https://image.tmdb.org/t/p/w500/uGYnClpynAYQAzy3rQBPWpEkHf1.jpg,94,7.529,207,3.7016,김창주,"조우진, 이재인, 지창욱, 진경"
852370,아이돌 승하의 19금 AV를 찍자,아이돌 승하의 19금 AV를 찍자,2021-06-24,AV도 연습이 필요해!  성인영화 제작비를 배상할 위기에 처한 촬영감독 나은과 연출자 영태. 엉망이 된 촬영을 서로에게 탓하기 바쁘다. 재촬영을 하기에 앞서 나은은 영태에게 직접 배우가 돼서 촬영 연습을 하자 제안한다. 부끄러워하는 영태를 능숙하게 리드해나가는 나은. 연습의 끝은 어디까지일까...?,드라마,South Korea,,https://image.tmdb.org/t/p/w500/4CVYNzGwTMgOKxycg2LQO9slwfH.jpg,61,6.443,44,2.9749,Kim Ho,"채승하, 유정, Si Woo, Kang Seo"
814636,"식물카페, 온정","식물카페, 온정",2021-06-24,종군 사진 기자였던 현재는 전쟁에서의 트라우마로 일을 그만두게 되었다. 다시 찾은 할아버지의 수목원에서 어린 시절 느꼈던 식물과의 특별한 교감을 떠올렸다. 식물로부터 살아갈 용기를 얻은 현재는 도심 속의 식물 카페를 운영하게 된다.,드라마,South Korea,Match Cut,https://image.tmdb.org/t/p/w500/exVxjoc2Pmc61rUTQFWslS1kSgh.jpg,75,5.0,2,0.8296,최창환,"강길우, 이가경, 김우겸, 박수연"
597109,흩어진 밤,흩어진 밤,2021-06-24,"수민, 진호 남매가 사는 집, 부모는 남매에게 곧 이혼할 것임을 선포한다. 부모는 식구 네 명이 어떻게 쪼개져 살지 아직 결정되지 않았다고 하며, 보름가량 기다려 달라고 한다. 수민은 부모 중 누구와 살게 될지, 오빠 진호와도 떨어져 살게 되는 건지, 불안 속에서 하루하루를 보내는데, 부모는 그런 수민에게 한 가지 제안을 한다.",드라마,South Korea,"DGC, Cinesopa",https://image.tmdb.org/t/p/w500/oZqUc750MFkgrcTftiEqUCrNNyZ.jpg,81,5.5,2,0.3869,Lee Ji-hyoung,"문승아, Choi Joon-woo, Kim Hye-young, 임호준"
852361,쉿!누나의 비밀,쉿!누나의 비밀,2021-06-25,늦은 가을날 할머니 댁으로 놀러온 현수는 사촌누나와 아찔한 며칠을 보낸다.,"드라마, 로맨스",South Korea,,https://image.tmdb.org/t/p/w500/k3OihOOPPGK5OCeBcCeJ6hhNebn.jpg,90,0.0,0,0.7476,Pae Kon,"Joo Ah, Ye Seul, 조완진, Cha Myung-Hoon"
845264,그라운드 제로,그라운드 제로,2021-06-26,"1983년 태이고 호산 교도소, 아무도 기억하지 않는 그날 그곳에서 모든 것이 시작되었다. 배틀그라운드 세계관 펍지 유니버스 속 중요한 사건인 1983년 호산 교도소 폭동을 그린 단편 액션 영화.",액션,South Korea,"Gorilla 8 Productions, Nova Film",https://image.tmdb.org/t/p/w500/6mOHrRs5Hym6A72u8NFBrcc2qz7.jpg,9,6.818,11,2.5407,김지용,"마동석, 김민재, 박지환, Lee Kyu-sung"
1235127,비트클럽,비트클럽,2021-06-28,,로맨스,South Korea,,https://image.tmdb.org/t/p/w500/rEXwAnpf81lA8b0L3E6cFpklMlt.jpg,86,10.0,1,0.64,Heyday,"채승하, Han Seok-bong, Gil Dong, Jin Si-ah"
853282,주부들의 육체 비밀,주부들의 육체 비밀,2021-06-29,"수혁과 연지는 신실한 부부다. 수혁은 비록 낮은 신실하게 지내도 밤에는 거칠어 지고 싶지만 연지는 밤에도 여전히 신실하다. 수혁은 연지를 뜨거운 여자로 만들기 위해 후배 인섭을 이용한다. 인섭은 유리를 조종해서 연지를 더럽히지만, 연지에게 반한 그는 연지를 탐한다. 연지가 인섭가 잠을 잤다는 사실에 분노한 수혁. 수혁은 복수를 위해 유리를 탐하지만 아내 연지에게 들키게 되고, 연지는 유리와의 결합을 선포한다.  수혁은 연지를 지키기 위해 유리가 사실 동성애자가 아니라 양성애자라는 것을 밝혀야 한다. 수혁은 연지에게 인섭과 유리가 섹스 하는 장면을 보여준다. 하지만 유리도 인섭의 섹스가 달갑지만은 않은 상황. 인섭은 수혁의 명령에 강제로 유리를 겁탈하고 결국 유리는 연지가 자신에게 실망했다는 사실을 알자 연지에게 달려간다. 둘은 새로운 성 정체성을 찾는다.",드라마,South Korea,,https://image.tmdb.org/t/p/w500/yKZ8KQo5tmofar0UjpaozCrhRpP.jpg,82,0.0,0,0.5332,Ya Sin-soo,"Yeon Joo, So Jeong, Sae Bom, 민도윤"
842033,괴기맨숀,괴기맨숀,2021-06-30,"공포 웹툰 작가 지우는 아이디어를 찾아 괴기맨숀이라 불리는 허름한 아파트에 도착한다. 표정을 알 수 없는 중년의 관리인은 이 아파트에서 일어났던 기묘한 사건들에 대해 이야기보따리를 풀어내고, 504호, 708호… 지우는 사연을 들을수록 홀리기라도 한 듯 괴기맨숀에 점점 집착하게 되는데...! 미스터리한 맨숀! 5개의 에피소드! 괴이하고 섬뜩한 현실 공포가 온다!",공포,South Korea,"MCMC, Contents Panda",https://image.tmdb.org/t/p/w500/fv0M8kyW95FpsrhoLTSCcEVR6hf.jpg,106,7.253,219,3.6753,Jo Ba-reun,"성준, 김홍파, 김보라, 이창훈"
805054,열아홉,열아홉,2021-06-30,"임대아파트에서 엄마와 단 둘이 살아가는 열아홉 소녀 소정은 엄마의 급작스러운 사망이라는 커다란 사건을 겪게 된다. 만약 엄마의 죽음이 알려지면 임대아파트에서 쫓겨나게 될 것이며, 폭력을 일삼는 아버지가 집에 돌아올 수도 있다는 생각에 소정은 이 사실을 숨기게 되고 뜻밖의 자유를 얻게 되는데...",드라마,South Korea,Korea National University of Arts,https://image.tmdb.org/t/p/w500/g9WC1547DnGfh5GBdGX7uVVubDb.jpg,85,5.0,2,0.3,Woo Kyeng-hee,"Son Young-joo, Jeong Tae-seong, 변중희, Won Mi-won"
718596,빛나는 순간,빛나는 순간,2021-06-30,"최고의 해녀 진옥의 이야기를 다큐멘터리로 제작하려 제주도를 찾은 경훈의 귀여운 분투로 시작해 어느새, 깊은 바다와 산중에 묻힌 영혼들과 여전히 흐느낌을 멈출 수 없는 이들을 위한 정성스러운 위무가 되어가는 영화다. 다소 이완된 구성에도 불구하고 이 영화에 빛나는 순간들이 선연히 각인되는 이유는, 슬픔을 제 몸처럼 간직한 진옥과 경훈이 서로를 끌어안는 고혹하고도 사려 깊은 태도 때문이며, 영화가 이 고운 인물들을 용감하게 담아내기 때문이다.",드라마,South Korea,"Myung Films Lab, Myung Films, Whenever Studio",https://image.tmdb.org/t/p/w500/6xxPIzuv1Rrxu4FTbUvSH286PWG.jpg,95,6.0,1,0.8789,So Joon-moon,"고두심, 지현우, Yang Jung-won, 전혜진"
716863,좀비크러쉬: 헤이리,좀비크러쉬: 헤이리,2021-06-30,"평화로운 파주 헤이리 예술마을에서 갑자기 좀비사태가 일어난다. 헤이리 예술센터 개관을 맞아 모인 세 친구, 진선과 현아, 가연은 이 위기에 맞서기로 한다. 그리고 여기에 초보 유튜버와 커피공장 사장이 가세한다.","액션, 코미디",South Korea,,https://image.tmdb.org/t/p/w500/osqKP97luGJ4LzChvkEf9kQe3Y1.jpg,119,4.0,3,0.7217,Jang Hyun-sang,"공민정, 이민지, 박소진, 박명신"
628704,미드나이트,미드나이트,2021-06-30,"청각장애를 가진 경미는 귀가하던 길에 피를 흘리며 쓰러져 있는 소정을 목격하고, 그녀를 도와주려다 연쇄살인마 도식의 새로운 타겟이 된다. 살고 싶다는 의지로 미친듯이 도망치는 경미, 하지만 살인마의 발소리조차 들을 수 없고, 도식은 또 다른 얼굴로 나타나 경미를 위협하는데...","스릴러, 범죄",South Korea,"Peppermint & Company, Finecut, CJ Entertainment",https://image.tmdb.org/t/p/w500/oJoLrbgEqupECFC7TwcmSZY2JSn.jpg,103,7.3,271,5.4099,Kwon Oh-seung,"진기주, 위하준, 박훈, 길해연"
1391161,한나 때문에,한나 때문에,2021-07-01,"다섯 살 한나에게 이상한 소문이 떠돈다. 베트남 혼혈이라 말도 느리고, 반에서 이상한 짓을 한다고. 담임선생님 유영은 한나를 지키고자 거짓말을 한다.",드라마,South Korea,,,24,0.0,0,0.0579,Kim Dal-ri,"윤금선아, 유지아"
1004029,구해줘원나잇,구해줘원나잇,2021-07-01,,"드라마, 로맨스",,,https://image.tmdb.org/t/p/w500/uayfPMbWEgo1QmLB9cX0lH7XeOK.jpg,70,0.0,0,0.0423,,
843996,보통날,보통날,2021-07-01,"1. 꽃가루: 연극부 동아리에서 인정받지 못하는 예나. 선배는 물론 후배에게 까지 온갖 무시를 당하면서 연극 준비를 하는데, 1학년 후배들까지 있지만 예나에게 무대 위에서 꽃 뿌리는 역할을 시킨다. 보잘 것 없는 역할이지만 이것마저 열심히 하려는 예나이지만 선배는 자신의 연출을 가린다는 이유로 못하게 하려고 한다. 하지만 결국 꽃가루를 뿌리게 되고, 사람들에게 꽃가루가 이뻤다는 칭찬을 들은 선배는 그 칭찬을 자신의 몫으로 돌린다.  2. 개인적인 불온함에 대하여: 주유소 아르바이트를 하면서 생활비를 버는 정인은 몇 주 째 밀린 아르바이트비를 받지 못하고 있다. 어느 날, 손님이 버리고 간 쓰레기에서 무엇이든 다 이루어준다는 신(神)컴퍼니 전단지를 발견하게 되고, 그 전단지를 본 노을은 신을 믿지 않는 정인 대신 신컴퍼니의 무료체험 신청을 하게 된다. 처음에는 신의 존재를 믿지 않던 정인은 전화 이후 자신의 문제들이 해결되는 모습을 보고 신컴퍼니의 존재를 믿게 되고, 결국 밀린 아르바이트비마저 제대로 주려고 하지 않는 병현에게 복수를 하러 주유소로 향한다.  3. 너도 그렇다: 어른들은 모두 꼰대라고 생각하는 가출 청소년 은규는 월급날, 알바비를 떼어 먹히고는 홧김에 담배를 훔친다. 그 때문에 붙잡혀 가게 된 파출소에서 그는 청소년 상담사를 꿈꾸는 석환과 재회한다. 자신의 이익을 위해 은규의 삶을 '갱생'시켜 보려는 석환과 자신의 삶을 지키려는 은규는 대화를 나눈다.",드라마,South Korea,,https://image.tmdb.org/t/p/w500/thndeihN11SxWJAzPyLD8PtBCh0.jpg,67,5.0,1,0.2646,Kim Ye-na,"Sooyoung Kim, Ha-ri Jeong, 김지현, 박지안"
843326,영면,영면,2021-07-01,"안락사를 집행하는 의사, 자살을 시도하는 영정 사진사, 시한부 인생을 사는 젊은 남성, 코마 상태의 아들과 동반자살 하려는 여성 등 죽음 가까이에 있는 여러 인물들의 에피소드들을 다룬 옴니버스 단편영화",드라마,South Korea,,https://image.tmdb.org/t/p/w500/8XojrPBfPXOxyydtXSZ95Y22moc.jpg,55,0.0,0,0.1698,방성훈,"Sung Seungtaek, Hong San, Kim Youngyong, Kwak Min-jun"
843186,달콤한 저주,달콤한 저주,2021-07-01,"하준은 잘생긴 외모로 항상 친구들의 인기를 독차지한다. 그런 하준을 질투한 절친 민우는 몽귀를 소환하지만, 되려 하준에게 반한 몽귀는 하준과 매일 뜨거운 밤을 보낸다. 급기야 행복해 보이는 하준을 보며 민우는 또다른 계략을 꾸미는데…","공포, 로맨스, 판타지",South Korea,"STRONGBERRY, Matchbox",https://image.tmdb.org/t/p/w500/3QSSnlyyMmVqCSIuaU5q95LUM1b.jpg,31,6.8,4,0.4547,Kang Woo,"Bang Ji Hyun, Kim Seong Soo, Sung Yeon Ho, Kim Joon Bum"
832064,아이윌 송,아이윌 송,2021-07-01,"더 이상 노래를 할 수 없게 된 무명가수 물결은 주체할 수 없는 슬픔을 안고 무작정 안동으로 떠난다. 여행지에서 우연히 물결을 만난 영화감독 바람은 어째선지 그녀가 못내 신경이 쓰여 자꾸만 주위를 맴돈다. 그렇게, 소중한 꿈만 좇아 바쁘게만 달려온 이들은 어느덧 서로의 상처와 아픔을 공유하며 마음을 열기 시작하는데…",드라마,South Korea,,https://image.tmdb.org/t/p/w500/bCT7Y49Oc36ovYfDM0HAfnUuUuy.jpg,98,4.0,2,0.3286,Lee Sang-hoon,"함은정, 김태형, Yoon Sung-mo"
1237169,일탈아내,일탈아내,2021-07-02,,로맨스,South Korea,,https://image.tmdb.org/t/p/w500/tafT57QELR8uX3GZpomXybLz8Ae.jpg,67,0.0,0,0.8026,Richard Kim,"Ha Neul, Jin Si-ah, Min Jo-ah, 민도윤"
853131,논두렁 엘프,논두렁 엘프,2021-07-02,,"드라마, 로맨스",South Korea,,https://image.tmdb.org/t/p/w500/oawctBOn0KwohIrBzqyMWo1RMo8.jpg,73,0.0,0,0.3026,Captain Kim,"Alisa, Dal Rae, 상우, Hun-i"
604360,제8일의 밤,제8일의 밤,2021-07-02,"붉은 달이 뜨는 밤, 봉인에서 풀려난 `붉은 눈`이 7개의 징검다리를 밟고 자신의 반쪽, `검은 눈`을 찾아간다. 그리고 마지막 제8일의 밤, 그 둘이 만나 하나가 되면 고통과 어둠만이 존재하는 지옥의 세상이 될 것이다.","미스터리, 스릴러, 공포",South Korea,"Little Big Pictures, Gom Pictures, kth, Go Go Studio",https://image.tmdb.org/t/p/w500/a11TdGOWqASvbeMs7q0a1YLa5K.jpg,150,6.1,138,3.361,Kim Tae-hyoung,"이성민, 남다름, 박해준, 김유정"
1147323,비밀방의 선물,비밀방의 선물,2021-07-03,,,,,https://image.tmdb.org/t/p/w500/21W9RLSYXeh6eFmeoRJ3PScseOx.jpg,0,0.0,0,0.0143,,
846596,샤먼 로드,Shaman Road,2021-07-03,"다른 나라에 태어났지만, 도플갱어처럼 똑같은 삶의 행로를 걸어온 두 여인이 있다.  프랑스 주라의 작은 시골 마을에 한 아이가 태어났다. 그녀의 이름은 꼴레뜨.  한국의 서울 변두리 마을에 또다른 아이가 태어났다. 그녀는 성미.  꼴레뜨와 성미는 어렸을 때부터 들린 신의 음성과 영상들(visions)로 인해 남들과 다른 삶을 살 수 밖에 없었고, 이를 천형이라 생각했다.  2014년 프랑스에서 열린 세계샤머니즘축제에서 서로를 만난 뒤에야, 꼴레뜨와 성미는 그들의 특별한 능력이 세상 사람들의 아픈 상처를 어루만져주기 위한 신의 선물이라 생각한다.",다큐멘터리,,,https://image.tmdb.org/t/p/w500/kerihhqjqeinoFCyLLCQNxAtyCA.jpg,105,0.0,0,0.0571,Choi Sang-jin,"Park Seong-Mi, Colette Granjon-Rozotte, Philippe Rozotte, Marie Caroline Vanfrancken"
842691,육식콩나물,육식콩나물,2021-07-04,,,South Korea,,https://image.tmdb.org/t/p/w500/liRY8paVnDzEwZqBkWzSv6VKdEN.jpg,5,7.0,1,0.0143,Seo Sae-rom,
842690,보이지 않는 눈,보이지 않는 눈,2021-07-04,청설모를 쫓아 숲속으로 들어간 아이들이 보이지 않았던 눈들과 마주치며 기묘한 환상과 죄의식에 시달리게 되는데…,,South Korea,,https://image.tmdb.org/t/p/w500/jcb4peX1JyXyh26mnsMyIQIhXzp.jpg,8,0.0,0,0.0423,정승희,
1092999,낯익은 타인,낯익은 타인,2021-07-06,"가깝고도 먼, 당신은 나의 '낯익은 타인'.  <존재의 선물> : 50세 생일을 눈앞에 둔 중년남성 ‘존재’는 자신의 머리가 한 줌씩 빠지는 것을 발견하고 거울 속 자신의 모습에 실망한다. 그는 부인을 두고 다른 여자와 밀회를 가지곤 하지만, 애인 집에서 밤을 같이 보낸 적은 없다. 매번 집으로 돌아갈 뿐이다.  <서리> : ‘서리’는 얼마 전 남자친구 ‘정구’를 떠나 보냈다. 시간이 얼마간 흘렀지만 그녀는 아직도 그가 왜 갑자기 자신을 남겨두고 자살을 택했는지 이해할 수 없다. 또 그런 그녀를 찾아온 엄마는 슬퍼할 시간을 허락하지 않겠다는 듯 시끄럽기만 해, ‘서리’는 괴로워진다.  <추억에서 기다린다> : 우리가 사는 세계의 시간과 정반대로 흐르는 세계가 있다. 나이가 들며 자신의 존재감이 희미해져 감을 느끼던 ‘소영’은 우연히 가게 된 다른 세계에서 어린 아이로 다시 살 수 있는 기회를 얻는다. 그곳에서 행복한 시간을 맛보는 동안 삶에 대한 원망도 차츰 사그라드는데...  <길 잃는 사람들> : 인생을 스스로 끝내려 마음 먹고 있던 ‘준웅’에게 한 통의 전화가 걸려온다. 아버지가 알츠하이머에 걸렸다는 소식이다. 잠시 자살을 유보하고 마지막으로 아버지를 보러 집으로 돌아가는 그. ‘준웅’은 아버지의 뒤를 따라 걸으며 숨겨져 있던 어떤 진심을 엿본다.",,South Korea,,https://image.tmdb.org/t/p/w500/26gmgKFl55uxpP26nfm9kWMnoyU.jpg,0,0.0,0,0.073,,"Byeon Dong-wook, 이택근"
961597,잘세우는 형수님,잘세우는 형수님,2021-07-06,"성연은 남편 상우의 잦은 야근으로 성생활이 원활치 못한게 불만이다. 그러나 색다른 즐거움을 찾았는데, 그건 시동생 시후와의 은밀한 섹스다.  시후는 정연에게서 벗어나 보려고 여자친구 조아를 집으로 들어와서 지내게 한다. 개방적이고 천방지축인 조아는 집에 오자마자 뜻하지 않게 낮잠 자고 일어난 상우를 흥분시키고 만다.  안정을 찾은 시후는 밤에 조아와 행복한 섹스를 한다.",,,,https://image.tmdb.org/t/p/w500/fSQ7uqpxCyeX0PFx0ySikHxQcDz.jpg,70,0.0,0,0.0261,,
936559,또 다른 사육,또 다른 사육,2021-07-06,"도민은 보영에게 돈을 받으러 갔다가 그녀에게 반한다. 하지만 도민은 마음을 들키면 안 된다. 보영은 그가 사육해야할 대상에 불과하니까. 도민은 보영을 사육하지만 그녀를 향한 마음이 멈추질 않는다. 도민의 마음을 알아챈 보영은 노예에서 탈출하기 위해 역으로 도민을 사육하기 시작한다.  보영은 준호와 함께 힘을 합쳐 우여곡절 끝에 도민 사육에 성공하고, 도민을 이용하여 노예에 탈출하려 하지만 성희에게 막힌다. 성희는 보영과 준호를 도출에게 팔아버리려 하고, 절체절명의 위기를 극복하기 위해 보영은 최후의 발악을 한다. 결국 성희를 처치하는 데 성공하는 보영과 준호. 보영은 성희와 도민에게 복수를 하며 성공을 만끽하지만 준호의 습격을 당한다. 준호에 의해 보영은 다시 노예로 전략한다.",로맨스,South Korea,,https://image.tmdb.org/t/p/w500/bbeVWfRCVGrljOVjetm9Ko30GSO.jpg,96,4.0,1,2.1377,Ya Sin-soo,"Rika, Sae Bom, Yeon Joo, 민도윤"
846240,25년 사귄 커플,25년 사귄 커플,2021-07-06,,,,,,3,0.0,0,0.1266,정가영,
843084,매미,매미,2021-07-06,소월길에서 몸을 파는 트랜스젠더 창현에게 낯선 듯 낯익은 손님이 찾아온다.,드라마,South Korea,Korea National University of Arts,https://image.tmdb.org/t/p/w500/4c9q3ekGtjIiAlXSS7j0fFct8Gg.jpg,17,4.0,3,0.2589,Yoon Dae-woen,"Kim Nina, Jung Yi-jae"
831480,CCTV,CCTV,2021-07-07,"10년 전. 8명이 죽고 1명이 행방불명이 된 전대미문의 살인극. 바로 이 끔찍한 살인사건의 유일한 생존자를 유튜버가 찾아간다. 유튜브 채널의 획기적인 조회수와 구독자 증가를 가져올 생존자와의 인터뷰가 시작되자... 10년 동안 숨겨졌던 끔찍한 사실이 드러나고, 아직도 끝나지 않았던 복수가 10년 만에 마무리 되는데... 죽음을 부르는 눈동자, CCTV의 공포가 드러난다.",공포,,,https://image.tmdb.org/t/p/w500/ePl9Q70kpiZCwPYbsUFKnOZLqRH.jpg,99,6.0,6,0.5794,Kim Hong-ik,"곽도원, Park Ki-ryung, 김단미, Kwak Ji-sook"
1391138,젖꼭지 3차대전,젖꼭지 3차대전,2021-07-08,방송국 피디인 용은 노브라 연예인의 젖꼭지가 나온 방송 화면에 모자이크를 하라는 부장의 명령을 받는다.,코미디,South Korea,,https://image.tmdb.org/t/p/w500/aqH6VCJtO1SsPn7QcgZ7dRSVKkm.jpg,23,0.0,0,0.2816,Paek Si-won,"최성은, 정인기, Jang Yo-hoon"
1352414,숏버스 이별행,숏버스 이별행,2021-07-08,"웃음과 눈물이 번진 이별 기억... 위로가 필요한가요?  전남친의 집을 찾아간 `진아`, 무대에서 폭발한 밴드 보컬 `혜승`, 백수 남친과 아직도 못 끝낸 `혜수`, 새로운 시작을 꿈꿨던 `미영`.  네 편의 단편영화와 함께하는 이별 여행이 시작됩니다.",,,,https://image.tmdb.org/t/p/w500/xPZ9XCCdDlXYushqh9sxCMMM7K2.jpg,65,0.0,0,0.0071,,
896457,바다 위의 별,바다 위의 별,2021-07-08,,애니메이션,South Korea,,https://image.tmdb.org/t/p/w500/hFLlpKEJRoAR09OKms0obUR0lVl.jpg,6,6.5,2,0.0071,Jang Seung-wook,
880234,칠흑,칠흑,2021-07-08,,"스릴러, 미스터리",South Korea,,https://image.tmdb.org/t/p/w500/9tIc1iG05YguRTOGtdDvcrJkEJV.jpg,27,0.0,0,0.181,Lee Jun-sup,"Lee Hyoung-hoon, Kong Ye-ji, Kim Jung-soo, Ha Sung-kwang"
878925,순수의 숲: 직시의 습격,순수의 숲: 직시의 습격,2021-07-08,,판타지,South Korea,,https://image.tmdb.org/t/p/w500/hljMEiRPgG4vJMj6Hyp2FhAT2Lk.jpg,30,0.0,0,0.0071,Kang Dong-won,"Park In-young, Lee Young-ji"
850322,죽이는 감독,죽이는 감독,2021-07-08,독립영화계에서 주목받는 감독 엄하늘. 신작의 촬영 현장에서 엄하늘은 안하무인에 제멋대로 행동하고 성가신 여배우까지 가세하자 스태프들은 점차 지쳐만 간다. 예정에 없던 추가 촬영이 생기자 스태프들은 폭발하고 결국 자기들만의 새로운 영화를 만들기로 한다.,코미디,,Korean Film Council,https://image.tmdb.org/t/p/w500/51HGERo6Gw3pCtNGUWL3U4dfars.jpg,10,0.0,0,0.4895,엄하늘,"엄하늘, 손예원, 배소은, 손용범"
