영화 ID,제목,원제,개봉일,줄거리,장르,국가,제작사,포스터 URL,러닝타임,평점,투표수,인기도,감독,주연
956750,접몽,접몽,2022-04-29,시나리오 작가인 경주와 학원 강사인 민재는 5년 차 부부다. 경주는 한 쌍의 접시 중 한 개가 보이지 않자 민재에게 혹시 깨뜨리고 몰래 버린 것은 아니냐고 재차 추궁한다. 민재는 그 한 쌍의 접시가 애초에 한 개였던 것은 아니냐고 반문한다.,드라마,South Korea,,https://image.tmdb.org/t/p/w500/6pfArljcbsM8H9hoJHV6hrPh4dO.jpg,25,0.0,0,0.5704,Eugene Mok,"김신록, 전석찬"
956748,힘찬이는 자라서,힘찬이는 자라서,2022-04-29,"정희는 고등학교 때부터 친구였던 소연의 집에 집들이를 간다. 늦게 도착하는 또 다른 친구 보영을 기다리면서 정희와 소연, 소연의 남편 강석은 정희가 쓰고 있는 시나리오에 대해 이야기를 나누다 설전을 벌이게 된다.",,South Korea,,https://image.tmdb.org/t/p/w500/wBFw41Vv7XZ6apj4UWkgV8HpMT0.jpg,34,0.0,0,0.41,Kim Eun-hee,"손수현, 안소요, 노재원, Song Jung Hee"
956745,주인들,주인들,2022-04-29,"각자의 애인과 이별을 한 지 얼마 되지 않은 두 친구가 있다. 두 사람은 서울의 한 숲을 산책하던 중 벤치에 놓인 가방을 발견한다. 얼마 뒤, 두 친구는 강원도로 점을 보러 떠난다. 그런데 갑자기 누군가 나타나 그 가방이 자신의 것이라며 소리친다.",드라마,South Korea,,https://image.tmdb.org/t/p/w500/spvnP67t1JodXbcxVinHTxIn2Dl.jpg,20,0.0,0,0.3001,Jo Hee-young,"공민정, Kim So-ryeong, 정회린"
953536,이창동: 아이러니의 예술,이창동: 아이러니의 예술,2022-04-29,"한국을 대표하는 시네아스트 이창동을 그의 영화와 글을 통해 소개한다. 극적 아이러니란 본질을 중심으로 그에게 접근하는 시간 여행이기도 하다. 박하사탕에서 영감을 받아, 현재에서 출발해 작가 시기를 거쳐 어린 시절까지, 그의 예술적 근원을 향해 시간을 거슬러 올라간다. 그의 영화에 출연했던 배우들과 오정미 작가가 감독과의 협업을 회상하는 동시에 각 촬영지의 현재를 살펴보는 과정을 통해 위대하고 비범한 예술가의 시작을 밝힐 것이다.",다큐멘터리,"South Korea, France",,https://image.tmdb.org/t/p/w500/zKYZS3wBUiGwsKGqk98vSIpQEoo.jpg,100,7.5,2,1.1267,Alain Mazars,"이창동, 유아인, 이다윗, 전도연"
974504,매력적인 큰엄마,매력적인 큰엄마,2022-04-30,방학을 맞아 큰 아버지 집에 머물게 된 대학생 명근. 큰 아버지는 젊고 매력적인 여자와 재혼을 했다.,,,,,0,0.0,0,0.0362,,
957529,아침의 빛,아침의 빛,2022-04-30,연인 상황극을 하며 원나잇을 한 요미와 훈. 요미는 훈에게 전화번호를 줄 테니 예비 부부인 척해달라고 제안하며 남의 집을 구경하자고 한다. 그리하여 가게 된 집엔 실제 부부가 살고 있고 이들의 갈등에 요미와 훈도 같이 얽히게 된다. 자신이 보고 싶었던 것과 다른 상황들이 연속되자 주인공 요미는 결국 집 밖으로 뛰쳐나온다.,,South Korea,,https://image.tmdb.org/t/p/w500/b4LsEmPlGz3CwoUy0sDvIHbQPhV.jpg,28,0.0,0,0.242,Jung In,Kimchoi Yong-joon
957528,마음에 들다,마음에 들다,2022-04-30,"오늘 학교에 가지 않은 고등학생 은하는 이모네 집에 들렀다가 이모에게 걸려온 엄마의 전화 통화를 듣게 된다. 엄마는 요새 은하가 꼴 보기 싫다는 얘길 하는데, 은하는 엄마의 마음에 들고 싶다.",드라마,South Korea,,https://image.tmdb.org/t/p/w500/m8qBWT1wrlHyNgERDztcoDsrZqw.jpg,23,0.0,0,0.1922,Kang Jee-iee,"장해금, 배영란"
957527,꼬마이모,꼬마이모,2022-04-30,"집안의 골칫거리 ‘꼬마이모’ 지란과 그런 이모를 세상에서 제일 멋지다고 말하는 열두 살 조카 소영의 찌릿찌릿한 ‘가슴’ 성장 이야기. 코로나19와 함께 찾아온 무더운 여름. 엄마 지숙이 운영하는 식당에는 손님이 뚝 끊기고, 꼬마이모 지란은 몇 달간 준비하던 공연이 취소된다. 가족들이 각자의 고민으로 바쁜 와중에도 소영의 가슴은 몽우리를 맺고 성장한다.",,South Korea,,https://image.tmdb.org/t/p/w500/kpyxCY4zTYc16aFAxaFSQjP0A3q.jpg,28,7.0,1,0.0143,An Sun-you,
957313,현수막,현수막,2022-04-30,"사라진 언니가 15년 만에 돌아온다. 동생 지호는 언니, 엄마와 함께 서울 곳곳에 걸려 있는 언니의 실종 현수막을 수거하러 다닌다.",,South Korea,,,25,0.0,0,0.0193,Yoon Hae-sung,
957310,오 즐거운 나의 집,오 즐거운 나의 집,2022-04-30,"고향으로부터 도망쳐 온 서울에서의 생활을 처분하는 아이들. 임신 중지를 앞두고, 엄마와 집이 있는 속초로 향한다.",,South Korea,,,37,0.0,0,0.2053,Lee Hae-ji,"이연, 나애진, 오민애"
957307,야행성,야행성,2022-04-30,"열여덟 해원은 엄마를 외롭게 하는 아빠가 밉다. 같은 아파트에 사는 하영은 유일한 가족이던 아빠마저 죽은 후에 혼자 남게 되는데. 모두가 잠든 야심한 밤, 해원과 하영은 철없는 어른들을 향한 복수를 시작한다.",드라마,South Korea,,https://image.tmdb.org/t/p/w500/z2RkfhsVgNOJlVvL6FJ8zJI9DuU.jpg,26,0.0,0,0.1081,Park Ji-su,"Seok Chan, Lee Kyung Min, Min Hyo-kyung"
957302,낙마주의,낙마주의,2022-04-30,"주영과 연우가 3년간의 연애를 끝낸다. 인공 폭포 앞에서 만난 둘은 서로의 물건을 교환하고, 폭포의 시작점을 확인하겠다며 산을 오른다. 그들은 화내고 물건을 던지다가 또 화해하고 대화하면서 산을 오른다. 정상에 도착한 연우는 주영에게 제안한다. 내가 목말을 태워줄 테니, 너는 폭포가 어떻게 생겼는지 말해달라고.",,South Korea,,,26,0.0,0,0.052,Haam Yuni,
957301,심장의 벌레,심장의 벌레,2022-04-30,"미숙과 준기는 더 이상 같이 사는 부부가 아니지만, 준기는 매년 한 번씩 미숙의 집에 밥을 먹으러 온다. 올해도 빈둥빈둥 종일 소파에 누워 음식을 기다리던 준기는 딸 은영이 집에 도착하자 미숙에게 산책을 나가자고 제안한다. 미숙은 마지못해 산책을 따라나서는데, 산책길에 미숙은 준기에게 그동안 숨겨왔던 어려운 고백을 하게 된다.",로맨스,South Korea,,,24,0.0,0,0.0071,Han Won-young,
957297,유빈과 건,유빈과 건,2022-04-30,"물이 흐르지 않는 계곡 깊숙한 곳에 유빈과 건, 두 아이가 있다. 서로가 서로에게 유일한 두 친구. 그들에게 건천은 최고의 집이자 놀이터이나 그 마음을 알아주는 사람은 아무도 없다.",드라마,South Korea,,https://image.tmdb.org/t/p/w500/sM8DYZGUoDn8Iam3Im04PSgBdob.jpg,26,0.0,0,0.1812,Kang Ji-hyo,
957293,분더카머 10.0,분더카머 10.0,2022-04-30,미래의 한 가상 도시. 보다 안정적이고 빠른 자율주행 서비스를 제공하기 위해 만들어진 운영 체제 ‘분더카머 10.0(Wunderkammer 10.0)’은 지도 데이터를 크롤링해 스스로 학습한다. 특정 타임라인 내의 데이터에만 한정적으로 접근할 수밖에 없는 한계를 맞닥뜨린 분더카머는 인터넷에서 오래전 만료된 여행 블로그를 발견한다.,SF,"Netherlands, South Korea",,https://image.tmdb.org/t/p/w500/1aCwnLo4yH3CtskJDqERwPKqelx.jpg,31,0.0,0,0.0261,Ki Yelim,
957261,소문의 진원지,소문의 진원지,2022-04-30,"평범한 일상 속에서 북한산이 지진을 일으키며 자라난다. 조금씩 아주 조금씩, 환상 세계와 현실 세계의 경계에 미세한 균열이 나타나자 누군가는 눈에 보이지 않던 세계의 존재를 눈치채기 시작한다.",애니메이션,South Korea,Lithium Studios,https://image.tmdb.org/t/p/w500/27o7r8QlIaJ7Gh2Rj0JQbJOJvJM.jpg,11,0.0,0,0.065,Hahm Hee-yoon,
957257,겹겹이 여름,겹겹이 여름,2022-04-30,"여름날, 헤어진 연인이 우연히 마주친다. 이들의 우연한 만남은 둘 간의 10년의 세월을 거쳐 세 번의 각기 다른 여름날로 이어진다.",로맨스,South Korea,Korea National University of Arts,https://image.tmdb.org/t/p/w500/wwB8S94NCyFueJX2WJJr2abKl7M.jpg,34,0.0,0,0.1199,Paek Si-won,"김우겸, Lee Noah"
957256,그렇고 그런 사이,그렇고 그런 사이,2022-04-30,"선지는 새언니가 된 친구 진희와 제사상에 올릴 전을 부친다. 분명 결혼 전까진 쿨한 친구였는데, 오늘따라 진희가 엄마 영순을 대하는 태도가 불편하다.",코미디,South Korea,"Korean Film Council, Central Park Films",https://image.tmdb.org/t/p/w500/yywsJtMNOaZGEYrW6tlnEzqVaOb.jpg,30,0.0,0,0.6141,Kim In-hye,"Joo Ga-young, Kim Gang-hui, 오민애, Shin Beom-cheol"
957251,한낮의 침입자,한낮의 침입자,2022-04-30,딸에게 남자친구가 생겼다. 조급해진 영희는 자신이 집을 비우는 시간 동안 딸과 남자친구가 잠자리를 갖는 꿈을 꾸게 된다.,미스터리,South Korea,,,26,0.0,0,0.0143,Kim Jin-hyeong,
956790,그대라는기억 연숙씨,그대라는기억 연숙씨,2022-04-30,"알츠하이머 치매라는 진단을 받고 차츰 병이 악화되는 아내 연숙씨, 기억은 사라지고 말을 잊기 시작했으며 음식을 먹으면 씹어야 한다는 사실조차 잊혀진 그녀의 시간은 거꾸로 흘러가고 있다. 그녀의 곁을 지킨 사람은 남편 규홍씨, 모든 걸 다 잊어도 유일하게 아내가 기억하는 사람은 남편뿐. 하루를 온전히 아내를 위해 보내는 남편은 어느 날 시한부 선고를 받는다. 13년을 자신보다 아내가 먼저였던 남편. 아내는 기억을 잃어가고, 남편은 기운을 잃어간다.  하나뿐인 딸은, 충격으로 아버지의 상태가 급격히 나빠질까 고민한다. 이 사실을 어떻게 전해야 할까? 자신이 암이라는 사실을 알게 된다면 남편은 어떤 결정을 내리게 될까?",다큐멘터리,South Korea,Dreamfact Entertainment,https://image.tmdb.org/t/p/w500/u4shu6f1sVwOuIaTrXHJuLNzVXj.jpg,79,0.0,0,0.0193,Sim Mi-hee,"Kyu Hong Lee, Lee Yeon-sook"
956773,평양랭면,평양랭면,2022-04-30,옥류관 수석 주방장 철중은 남한에 동생을 둔 이산가족이다. 이번 생에 다시 만나기는 틀렸다고 생각했지만 2018년 남북정상회담에서 남측이 요청한 평양냉면을 직접 만들기 위해 파견된다. 때마침 동생도 남측 수행원으로 참석한다는 걸 알게 된 철중은 동생이 꿈에도 잊지 못하는 어머니의 맛이 담긴 평양냉면을 만들어주기 위해 노구를 이끌고 판문점으로 향한다.,,South Korea,,https://image.tmdb.org/t/p/w500/wGWxueGdwIuZvimagJTDmL6S4ij.jpg,26,0.0,0,0.9263,Yoon Ju-hun,"백일섭, 이유비"
953535,심장소리,심장소리,2022-04-30,여덟 살 철이는 등교를 하지만 집에 홀로 남은 채 우울증을 앓고 있는 엄마가 잘못될까 무서워 수업 도중 집으로 달려간다.,드라마,South Korea,World Health Organization,https://image.tmdb.org/t/p/w500/sf1BmAwYm13brRHWrR9fC7PXT22.jpg,28,0.0,0,1.2115,이창동,"Kim Gun-woo, 전도연, 설경구, 박보경"
1437739,And the Dream That Mattered,And the Dream That Mattered,2022-05-01,,드라마,"United States of America, South Korea",,https://image.tmdb.org/t/p/w500/e4KufQ9kYbdkHs3YdFW7wfyCFmO.jpg,0,0.0,0,0.4528,Byun Joo-hyun,"Kim Jong-man, Hyejeong Choi, Byun Joo-hyun, Themo Melikidze"
1387636,천신당신음공주,천신당신음공주,2022-05-01,,,,,https://image.tmdb.org/t/p/w500/bet2J04heAWukASkHlmK5JSSrRt.jpg,78,0.0,0,0.1946,,Ye Ri
1209219,동우,동우,2022-05-01,,드라마,South Korea,,,18,0.0,0,0.0071,Hobeom Park,
973361,Beyond LIVE – Stray Kids 2nd World Tour “MANIAC” in SEOUL,Beyond LIVE – Stray Kids 2nd World Tour “MANIAC” in SEOUL,2022-05-01,,"다큐멘터리, 음악",,,https://image.tmdb.org/t/p/w500/fOmJHjGlIab4xoNwdhWEmc1JOYK.jpg,240,10.0,2,0.4058,,"Bang Chan, Lee Know, Changbin, Hyunjin"
964198,영희,영희,2022-05-01,터프한 성격의 영희는 노력은 하지만 공감능력이 전혀 없는 전남친을 뒤로 하고 완벽한 이상형에 가까운 철수에게 첫눈에 반한다. 그는 다를꺼라 생각하며 철수와 영희는 변함없는 사랑을 약속하고 주변에서 부러움을 살 정도로 알콩달콩 둘만의 사랑을 싹 틔운다. 전 남친은 관계정리가 깔끔하지 못했다는 이유로 스토킹 하며 둘을 괴롭히지만 그런 방해에도 불구하고 꿋꿋하게 사랑을 이어간다. 그렇게 행복하기만 한 둘에게 돌연 철수가 행방불명 되며 이야기는 다른 방향으로 흘러간다. 철수를 찾아 나서는 영희. 엎친데 덮친격으로 결혼하면 집장만을 위해같이 만든 통장에 돈이 전부 빠져있고 의심을 안 할수가 없는 상황이지만 영희는 철수를 믿으며 고군분투 추적끝에 전남친이 연관되어 있다는 생각을 한다. 과연 그 끝에 도달한 진실은 무엇일까. 영희의 고군분투 예측불허 로맨틱코미디가 시작된다.,코미디,South Korea,,https://image.tmdb.org/t/p/w500/dH8I1WZrrMINf2zxgazW9oe0uP3.jpg,112,3.5,2,0.4044,Cha Sang-min,"Eunsoo Ki, Seo Beom-seok, Ho-Chul Lee, Moon Seobyeol"
927904,뉴타운 생존자 수색작전,뉴타운 생존자 수색작전,2022-05-01,"“연못 정비 작업 중 신원미상의 시신 3구가 발견되었다.” 도시괴담으로부터 시작해 한 여인은 도시를 떠돌며 여러 가지 단서들을 찾아간다.",미스터리,,,https://image.tmdb.org/t/p/w500/g6cJSdV0dPPfrmF1vnYF3GDqyu4.jpg,52,5.0,1,0.0286,Kang Min-gu,
970587,김치,김치,2022-05-03,,드라마,Canada,Toronto Metropolitan University,https://image.tmdb.org/t/p/w500/x9H9t57PFeqnkCKJ2cxLRMBLYZb.jpg,10,0.0,0,0.0814,Tommy Lee,"Raymond Chan, Chandler Qian, Selena Kang, Ethan Kim"
987874,"새로운 집, 섹스 메뉴얼","새로운 집, 섹스 메뉴얼",2022-05-04,"드디어 생에 첫 집이 생긴 그녀, 기쁜 마음으로 집에 들어섰지만.. 이상하게 많은 물건들, 먹다가 남은 음식들까지 있다? 그때 마침 들려오는 발자국 소리.. 왠 모르는 남자가 내 집안에 있다?! 천천히 대화를 나눠보니 계약사기를 당한 여자.. 문제가 해결될때까지 같이 살게 해준다는 남자.. 그들의 아찔한 동거가 시작된다.",,,,,0,0.0,0,0.0071,,
971942,우라까이 하루키,우라까이 하루키,2022-05-05,1986년 홍콩을 거쳐 2022년 목포에 당도한 영화감독 만옥이 여명을 다시 만나 영화 만들기의 진정한 의미를 전수 받는 이야기,"드라마, 로맨스",South Korea,"JTBC, TVING, 영화사 명랑성",https://image.tmdb.org/t/p/w500/cWhKHu8h6W4nD8x5KkN5eQILakk.jpg,26,0.0,0,1.1511,김초희,"임선우, 고경표, 강말금, 김담호"
917898,액션동자,액션동자,2022-05-05,"부모님과 더 이상 함께 살 수 없는 초등학생 진구는 동자승들일 기거하는 절에 들어가게 된다. 소심함 성격에 전학 간 학교에서조차 또래들과 어울리지 못하고 동자승과도 제대로 어울리지 못하는 날들이 이어져 정법 스님에게 혼나는 날이 계속 이어진다. 그러던 어느 날 절에 도둑이 들어 불상과 탱화를 훔쳐 달아나고, 이를 저지하기 위해 싸운 법정스님까지 쓰러지게 된다. 유일하게 도둑들의 얼굴을 목격한 진구는 용기를 내어 정법, 가진, 돼지 스님과 함께 도둑을 잡기 위해 나서기로 결심한다. 과연 진구와 동자승 팀은 도둑 맞은 유물을 되찾고 무사히 돌아올 수 있을까?",액션,,,https://image.tmdb.org/t/p/w500/1zS52jL8K7vq2j0vkTRSBw6hy4k.jpg,102,5.0,1,0.3649,CHOI Young-min,"Hong Jeong-min, Yoon Sungwoo, 최현진, Heesoo Ham"
1362833,두 집 살림,두 집 살림,2022-05-06,,드라마,South Korea,,https://image.tmdb.org/t/p/w500/iXYv7Ok8qjcHclSB6Fcq1bwQAbt.jpg,0,0.0,0,1.1504,전성기,"Gil Dong, Han Seok-bong, Rika, Sae Bom"
1016035,섹스하우스 : 파트너 쉐어,섹스하우스 : 파트너 쉐어,2022-05-06,,로맨스,South Korea,,https://image.tmdb.org/t/p/w500/jxpjmGVFskJcSzmi8O5WIrWEV5S.jpg,69,2.0,1,0.4959,Yoon Shin-I,"Han Yi-seul, Mi Ho"
1086509,38년생 김한옥,38년생 김한옥,2022-05-07,"승훈은 어느 날 갑작스레 어머니 김한옥이 저혈당으로 쓰러진 뒤로, 어머니가 언제 어떻게 될지 모른다는 생각에 어머니가 계신 청주에 내려와 살고 있다. 승훈은 영화를 전공하고 연출하는 감독인데, 약 10년 전부터 가족에 대한 다큐멘터리를 찍고 있다. 그런데 아버지도 돌아가시고, 큰형도 돌아가셔서 어느새 집안에 큰 기둥이라고 할 수 있는 건 어머니밖에 남지 않았다. 그래서 어머니와 같이 지내게 된 이참에 어머니의 삶을 평전으로 남기는 작업 또한 함께 하고 있다.",다큐멘터리,South Korea,,https://image.tmdb.org/t/p/w500/8GkBVbYLCyCBX481yhjNkco3gBM.jpg,112,0.0,0,0.0143,Chae Seung-hoon,
1087211,XX+XY,XX+XY,2022-05-09,"여성과 남성, 두 개의 성별을 가지고 태어난 재이는 용기를 내 일반 고등학교에 진학한다. 친구들과 함께 지내다 보면 어떤 성별로 살아가고 싶은지 알 수 있게 될 것이라 생각했는데, 오히려 더 혼란스럽기만 하다.",,,,https://image.tmdb.org/t/p/w500/szhT9Vngx6uOOQRvvYeM15bfI16.jpg,128,8.5,2,0.2101,Soh Yoon Lee,"안현호, 최우성, 김지인"
1013089,아동학대 자진신고 1년의 기록: 내 이웃의 아이,아동학대 자진신고 1년의 기록: 내 이웃의 아이,2022-05-09,"“친권자는 자녀를 보호 또는 고양하기 위해 필요한 징계를 할 수 있다.” ― 민법 제915조. 2021년 1월, 63년 만에 민법 제915조 징계권 조항이 삭제됐다. 이로써 가정 내에서 행하는 훈육을 위한 모든 체벌은 범죄가 됐다. 작년 4월, 한 아이의 엄마가 경찰서에 자신의 아동 학대 사실을 자진신고했다. 뉴스에서 보는 참혹한 아동 학대 사건은 아니다. 거짓말을 한다는 이유로, 청소를 하지 않았다는 이유로, 훈육이라는 이름으로 시작된 체벌과 언어폭력이 어느 순간 멈춰지지 않았다. 자진신고 이후 자신의 학대를 멈추겠다는 강한 의지에도 불구하고, 변화는 더디다. 이 다큐멘터리는 아동 학대 자진신고를 한 어머니 사례를 찾아 그 후 1년을 밀착 취재한 다큐멘터리로, 사건 취재가 아닌 일상의 훈육이 학대가 되는 지점을 보여주는 관점으로 접근했다. 가해와 후회를 반복하는 어머니와 기대와 절망을 반복하는 아이의 상황을 담담하게 포착하고, 국가의 개입이 이루어짐에도 불구하고 학대를 멈추는 과정이 쉽지 않음을 드러냈다. 예측 불가능했던 1년의 기록은 사안의 복잡성을 깨닫게 하고, 치유와 개선의 어려움과 희망을 동시에 보여준다.",다큐멘터리,South Korea,,,56,0.0,0,0.0,Bin Jung-hyun,
1016026,맛있는 마사지,맛있는 마사지,2022-05-10,,로맨스,South Korea,,https://image.tmdb.org/t/p/w500/qHrHPNcZ4lwcTSQ5hu5zSXwt7cb.jpg,78,1.0,1,0.9048,Yoon Soo-hyun,"이수, Kang Min-woo, So Jeong, Sun Ho"
983294,힐링하우스 : 섹스의 왕국,힐링하우스 : 섹스의 왕국,2022-05-10,"혜경은 순실과 정섭의 가정부로 들어간다. 우연히 순실과 같은 사이비 종교라는 것을 알게 된 혜경!  순실과의 소속감을 이용하여 애인 태봉을 집으로 끌어들인다.  한편 순실은 태봉에게 홀리고, 순실의 남편인 양아치 정섭은 혜경에게 빠져든다.  서로를 차지하기 위해 혜경, 정섭, 순실, 태봉은 머리를 굴린다.","로맨스, 드라마",South Korea,,https://image.tmdb.org/t/p/w500/498GLLKKBHoECx3o3cedb7PTWED.jpg,0,2.0,1,0.9754,Yoon Soo-hyun,"Chae Ah-ra, 민도윤, Sung Yeon, Kang Min-woo"
959249,어부바,어부바,2022-05-11,"부산 해안가 포구의 멋쟁이 ‘어부바호’ 선장 종범은 철없는 동생의 느닷없는 결혼 선언과 늦둥이 아들의 첫사랑, 친구들과의 우정까지 사랑하는 가족을 지키기 위해 하루하루 고군분투한다. 그러던 어느 날 자신의 분신이자 아들 노마에게 엄마같은 존재인 ‘어부바호’가 빼앗길 위기에 처하게 되는데…","가족, 코미디",South Korea,Triple Pictures,https://image.tmdb.org/t/p/w500/fzRBD0LFXxMFnCH9xiSecp8QbOK.jpg,106,4.0,2,0.3357,최종학,"정준호, 최대철"
981320,노래방 유부녀들,노래방 유부녀들,2022-05-12,남편과 섹스리스로 외로운 연서는 친구 주연과 함께 노래방 도우미 알바를 시작한다.  코스프레 의상과 2차까지 가능하다는 입소문에 노래방은 남자 손님들의 예약으로 문전성시를 이루는데…,,South Korea,,https://image.tmdb.org/t/p/w500/ctAD3ffw5QM8xWzA4q09tAklUku.jpg,61,0.0,0,0.0143,,
976853,잇츠 올라잇,It's Alright,2022-05-12,코로나 시대에 만연한 다양한 인간 군상들을 여섯 개의 이야기로 풀어낸 블랙 코미디,코미디,South Korea,"TVING, JTBC, 미스터해피픽쳐스",https://image.tmdb.org/t/p/w500/wNIJjNSXpsibEBMPv3tKnl5WHmS.jpg,23,0.0,0,0.5192,Joo Dong-min,"신은경, 엄기준, 이지아, 김소연"
964988,"허황옥 3일, 잃어버린 2천 년의 기억","허황옥 3일, 잃어버린 2천 년의 기억",2022-05-12,"역사학계가 2천 년 전 ‘인도 공주 허황옥’의 결혼 항해를 신화나 설화로 간주하면서 김해 김씨와 허씨 등 800여만 명의 후손들은 늘 뿌리가 흔들렸고, 가야사는 물론 가야불교의 시작도 수백 년 뒤로 밀려나 버렸다.  이 영화는 아직 한 번도 시도해 보지 않았던 삼국유사 ‘인도공주 허황옥’의 3일간 신혼길 기록을 과학적인 방법으로 추적해 나가며 누구도 예측하지 못한 독특한 역사적 실체를 도출한다.",다큐멘터리,,,https://image.tmdb.org/t/p/w500/fGzf4UHURTbcYQzAjNkoFrec291.jpg,93,0.0,0,0.0886,Jin Jae-un,"Do Myung, 김명곤, Baek Sohee, Kwon Hajin"
958226,데드캠핑 더 라이브,데드캠핑 더 라이브,2022-05-12,"인기 캠핑 유튜버 `수연`은 여느 때와 같이 외딴 산속에서 보내는 혼자만의 캠핑을 실시간으로 공개한다.  분위기가 한층 무르익을 무렵, `수연`은 알 수 없는 무리들에게 습격을 받게 되는데...  그러나 그 놈들은 알 지 못했다.  이 모든 것이 그녀가 준비한 것임을…  그리고 마지막 한 놈의 숨통이 끊어질 때까지 끝나지 않는다는 것을…","액션, 스릴러",South Korea,"Gnos, Fiveday, Kkuljam Company",https://image.tmdb.org/t/p/w500/7peuXcgHgZsJha7ctbefMnOdzVB.jpg,72,4.7,3,0.586,Kim Hyun-Woo,"손지현, Kim Ryu-an, 이푸름, Cho Myunghaeng"
1016025,애무의 신,애무의 신,2022-05-13,,로맨스,South Korea,,https://image.tmdb.org/t/p/w500/7iavrL9nf7nL2DiWubuO15MPhf0.jpg,73,4.0,1,0.9755,Richard Kim,"유정, Ha Yeon, Im Cho-hee, Cha Myung-Hoon"
1016023,온 가족 돌려먹기,온 가족 돌려먹기,2022-05-13,,로맨스,South Korea,,https://image.tmdb.org/t/p/w500/ySpvihmzX6lnhSu8HuxlvW8f7MS.jpg,70,3.5,2,0.3069,Sung Yi-sung,"Bo Yeong, 한예지, Seo Bo-ra, Dong Bin"
1016021,그놈의 오일마사지,그놈의 오일마사지,2022-05-13,,로맨스,South Korea,,https://image.tmdb.org/t/p/w500/1IdVEnnUTZ9NSiFwAK8JKw6JCDd.jpg,67,9.0,1,0.8404,Yoon Shin-I,"Mi Ho, 상우, Han Yi-seul, 우열"
965143,사이버 지옥: n번방을 무너뜨려라,사이버 지옥: n번방을 무너뜨려라,2022-05-17,성착취물을 제작하며 끔찍한 범죄를 일삼은 익명의 온라인 채팅방. 그 운영자들을 끌어내리기 위한 추적에는 용기와 끈기가 필요했다.,"다큐멘터리, 범죄",South Korea,Indiestory,https://image.tmdb.org/t/p/w500/iWI05wWFZvPKCgEqXihjUQLar7r.jpg,103,7.2,94,3.0802,최진성,
968501,쏴!쏴!쏴!쏴!탕,쏴!쏴!쏴!쏴!탕,2022-05-18,"80년 5월 광주를 서로 다른 위치에서 겪었던 세 인물이 9년 후 우연히 한 곳에서 만나 함께 살아가고 있다. 두 남자는 공사판에서 일하고 있고, 한 여자는 함바집에서 일하고 있다. 각자 상처와 악몽에서 벗어나지 못한 채 살아가고 있던 세 인물들이, 어느 날 뚜렷하게 되살아난 9년 전의 기억과 정면으로 마주하게 된다.","음악, 드라마",,,https://image.tmdb.org/t/p/w500/wPNyHS2sTjaQR8muFvtjgUEtedL.jpg,46,5.0,1,0.1814,Jaehan Kim,"Baek Seo-bin, Seolhee Kim, Kim Beom-seok"
863267,"아치의 노래, 정태춘","아치의 노래, 정태춘",2022-05-18,"싱어송라이터이자 시인, 그리고 사회운동가였던 정태춘. 그는 오래 전, 노래를 멈추었다. ‘아치의 노래’는 그의 절망의 끝에 나온 독백과도 같은 곡이다. 그런 그가 데뷔 40주년을 맞아 다시 대중 앞에 섰다. 노래는 무엇을 할 수 있는가? 세상과 타협하지 않고 자신의 길을 40년간 걸어온 노장 예술가의 사상과 음악, 우리 시대의 연대기가 음악 다큐멘터리로 펼쳐진다. 세대를 넘어서 정태춘의 노래가 주는 영감과 희망을 이야기한다.","다큐멘터리, 음악",South Korea,,https://image.tmdb.org/t/p/w500/v1fZBeLFkpOdUQF6WSelVlixCPD.jpg,120,0.0,0,0.2483,Goh Young-jae,"Joung Tae-choon, Park Eun-ohk, Yoo Ji-yeon, Kim Yong-hwan"
