영화 ID,제목,원제,개봉일,줄거리,장르,국가,제작사,포스터 URL,러닝타임,평점,투표수,인기도,감독,주연
938157,떡값내고 과외받기,떡값내고 과외받기,2021-10-07,,"드라마, 로맨스",South Korea,,https://image.tmdb.org/t/p/w500/tzqnf0sf6MecYccXHHzC0PazzDZ.jpg,70,0.0,0,0.8998,Alexa Park,"Ha Jin, 유정, Jung In"
885860,건전지 아빠,건전지 아빠,2021-10-07,,애니메이션,South Korea,,https://image.tmdb.org/t/p/w500/d8EwFAtFGY2AYlpMUm9g8DEbs2W.jpg,6,0.0,0,0.0256,Jeon Seung-bae,
878026,브라더,브라더,2021-10-07,"정의감과 패기로 똘똘 뭉친 강력계 형사 ‘강수’. 어느 날 그에게 마약 밀수입 등의 악질 범죄를 일삼는 거대 조직의 정보가 담긴 발신자 불명의 제보가 들어온다. 범죄 소탕을 위해 조직에 위장 잠입한 ‘강수’는 회장의 오른팔 ‘용식’ 밑에서 조직 생활을 시작하고 각자의 목적을 위해 한 팀이 된 두 사람은 묘한 우정을 느낀다. “이런 일이 안 어울린다고, 강수 너한테는” 한편, ‘강수’는 계속되는 비밀 수사 중 신분 들통 위기에 처하고 사건을 파헤칠수록 조직과 얽힌 충격적인 진실을 마주하는데… 복수와 배신이 교차하는 세계에 뛰어든 두 남자, 누구도 믿지 못할 팀플레이가 시작된다!",액션,,,https://image.tmdb.org/t/p/w500/quVE6ReK3zTNvI78ffTLJSKFSkf.jpg,97,3.0,2,0.8825,Shin Geun-ho,"조재윤, 정진운, 조원희, 정인기"
817480,피어썸,피어썸,2021-10-07,"공연을 할 수 없게 된 ‘승연’(조동혁)의 밴드는 재정비를 위해 춘천으로 떠나고, 우연히 그곳 클럽에서 멋진 실력을 보여준 그들은 정식 공연 제안과, 멋진 숙소까지 제공받게 된다. 하지만 휴식도 잠시 기타리스트 ‘재혁’(차선우)이 뭔가에 홀린 듯 점점 섬뜩한 행동을 하기 시작하고, 곧 이 집에 자신들만 있는 게 아니라는 사실을 알게 되는데…","공포, 미스터리",South Korea,,https://image.tmdb.org/t/p/w500/rOPGYktxPcWpkwvhrT70Wm8u9Bv.jpg,82,4.5,2,0.1425,이상헌,"조동혁, 차선우, 장석현, 임영주"
1404108,PINK BXXCH CLUB,PINK BXXCH CLUB,2021-10-08,,"애니메이션, 공포",,,https://image.tmdb.org/t/p/w500/3pLhJdybkxryuINTPWeQomYZVmG.jpg,1,0.0,0,0.0071,VIVINOS,
884741,말해줘,말해줘,2021-10-08,"이상형이 나타났다. 책 읽을 때만 쓰는 안경, 리본으로 묶은 후드끈, 끝이 없는 다리 길이, 사연 있어 보이는 팔뚝 흉터, 게다가 잘생긴 외모까지. 첫눈에 반한 그 남자에게 오늘은 꼭 고백하고 싶다.","로맨스, 드라마",South Korea,"STRONGBERRY, Matchbox",https://image.tmdb.org/t/p/w500/wS6yZ75LLow0G0jaD8CERjBKXAX.jpg,8,6.2,4,1.0303,Jang Young Seon,"Han Hyeon-jun, Ahn Jong-sun"
877464,철선,철선,2021-10-08,"경상남도 산청군 경호강변에는 한센인들이 거주하는 성심원이 자리 잡고 있다. 한국 전쟁 이후 구호물자를 처분해 구매한 강변의 땅이 한센인들에게 소중한 정착지가 되었고, 경호강 이편과 저편을 잇는 성심교가 놓이기 전까지 나룻배 '철선'만이 그들이 세상과 소통할 수 있는 유일한 통로였다.",다큐멘터리,South Korea,Cinema Takju Corp.,,76,0.0,0,0.0,Kim Ji-gon,
805061,희수,희수,2021-10-08,"여섯 살 난 딸 ‘희수’를 교통사고로 잃은 ‘주은’과 ‘태훈’은 상실감에서 벗어나지 못한 채 하루하루를 살아간다. 망가져가는 ‘주은’을 볼 수 없었던 ‘태훈’은 프로그램 개발자인 친구 ‘준범’의 권유로 딸 ‘희수’를 VR로 복원하게 되고, 다시 행복을 찾을 것만 같았던 가족은 AI ‘희수’에 대한 ‘주은’의 강한 집착으로 점점 파국으로 치닫게 되는데...","SF, 공포, 드라마, TV 영화",South Korea,,https://image.tmdb.org/t/p/w500/20QrRlC8rz4q6hzAsi9IcLScMgw.jpg,99,5.9,7,1.1687,Choi Sang-yeol,"전소민, 박성훈, 김강현, 박하나"
877490,우리는 서로 사랑해야 한다,우리는 서로 사랑해야 한다,2021-10-09,,드라마,South Korea,,https://image.tmdb.org/t/p/w500/w3ZYXzobfpy2dZlbeaMRJYT0YSo.jpg,19,0.0,0,0.0454,Lee Ru-ri,Lee Yu-bin
877487,거북이가 죽었다,거북이가 죽었다,2021-10-09,"인정은 회사에서 잘리고 키우던 거북이가 죽자 모든 것에 대해 남탓만 한다. 죽은 거북이를 들고 친구가 소개해준 면접을 가게 된 인정은 면접도 망치고 절친과도 갈등을 일으켜 헤어진 후 혼자 남게 되자, 자신을 불쾌하게 만들었던 알 수 없는 냄새의 원인이 자신의 손에 든 거북이였다는 사실을 깨닫게 된다.",,South Korea,,,29,0.0,0,0.1472,Kim Hyo-eun,이연
877485,죽고 싶은 학생,죽고 싶은 학생,2021-10-09,,,South Korea,,,15,0.0,0,0.0143,Park Jun-hyeok,
877483,공백,공백,2021-10-09,은숙은 가장 안쪽 화장실 칸막이에서 클래식 음악을 듣는 것만이 인생의 유일한 즐거움인 백화점 청소부다. 딸을 위해 좋은 학군으로 힘들게 이사를 하는 은숙에게 그녀의 삶은 늘 뒷전이다.,드라마,South Korea,,https://image.tmdb.org/t/p/w500/AuHYEUEV4Uvc9Jzohurw3gtTHed.jpg,18,5.0,1,0.0773,Shin Si-jeong,최희진
877481,나들이,나들이,2021-10-09,,,South Korea,,https://image.tmdb.org/t/p/w500/4OrVSau6YA7zMlC0K5wRVqAqcUz.jpg,23,0.0,0,0.2183,Lee Yu-jin,"강애심, 이선주, 우미화"
877479,둔내면 임곡로,둔내면 임곡로,2021-10-09,,스릴러,South Korea,,https://image.tmdb.org/t/p/w500/dDPdLbBc6yELWvSKDQqgVoqaIy7.jpg,20,0.0,0,0.297,Jeon Shi-hyoung,"Ki Do-young, 강길우, Ha Jun-ho, Jeong Jong-hoon"
877477,심부름,심부름,2021-10-09,,,South Korea,,https://image.tmdb.org/t/p/w500/3xhec7wSk2Ok7FnxGJ1xFUDGZIU.jpg,16,0.0,0,0.0071,Lee Young-woong,
877475,"그래도, 화이팅!","그래도, 화이팅!",2021-10-09,,,South Korea,,,20,0.0,0,0.0143,김준석,"김준석, Son So-ra"
877473,장갑을 사러,장갑을 사러,2021-10-09,피아노를 가르치는 인경은 연인의 일본 발령 소식에 일본어 학원을 다니기 시작한다. 일본어를 왜 배우는지 스스로 대답을 찾지 못한 채 그의 출국일이 다가온다.,로맨스,South Korea,,https://image.tmdb.org/t/p/w500/kK5VVQcfsauA0oruMrQMfXp8dUU.jpg,29,0.0,0,0.0577,Lee Hyeon-ju,Kim Jung-min
877472,굿 (Exorcism),굿 (Exorcism),2021-10-09,,애니메이션,South Korea,,,5,0.0,0,0.0379,PARK So-e,
877470,"어쩔 수 없는, 하루와 밤","어쩔 수 없는, 하루와 밤",2021-10-09,수시 특강을 들으러 서울로 온 서윤이 오래도록 집과 연락을 끊고 지낸 언니를 무작정 찾아간다. 거기서 서윤을 반가이 맞아주는 이는 언니의 연인이다. 어찌할 수 없는 하루와 밤 시간을 함께 하게 된 세 사람. 이윽고 아침이 온다.,,South Korea,,,19,0.0,0,0.0214,Lee Ji-hoo,Oh Su-yeon
877469,개미무덤,개미무덤,2021-10-09,"아홉 살 도진은 아파트에서 혼자 지내는 시간이 많다. 어느 날 개미무덤을 만들러 뒤뜰에 갔다가 살인현장을 목격하고, 흉기로 쓰인 피 묻은 벽돌을 집으로 가져온다. 아이의 눈으로 본 학교 폭력, 왕따, 살인 등의 이야기가 예측불허의 미스터리극으로 옮겨진다.",,,,,27,0.0,0,0.0193,이솔희,
877446,10월의 이름들,10월의 이름들,2021-10-09,"1979년 10월 16일, 부산대 학생들이 박정희 정권의 유신체제 철폐를 외치며 거리로 나섰다. 그게 시작이었다. 항쟁의 열기는 들불처럼 퍼져 5일간 지속되었고, 또 그만큼 신속하고 가혹하게 진압되었다. 그리고 6일 뒤, 박정희 대통령이 피살되고 유신체제는 무너진다.",다큐멘터리,South Korea,"Kookje Daily News, BARIM",https://image.tmdb.org/t/p/w500/77mhIbfbWkWPfiaurq2DjG3d5mK.jpg,97,5.0,1,0.5901,Lee Dong-yun,
877399,한 끗,한 끗,2021-10-09,"어두운 밤, 골목길에서 담배를 나눠 피우며 걷고 있는 두 남녀. 그들은 선후배 형사다. 이 밤에 둘의 사정은 조금 복잡하다. 그들은 지금 범인 검거 현장을 조작하여 재연해야만 한다. 어떠한 이유인지 검거한 범인을 다시 데려와 방송국 사람들을 속여, 실제와 다른 조작된 방송을 내보내려 한다. 하지만 일은 계획대로 되지 않고 점점 더 꼬여만 간다.",미스터리,South Korea,,https://image.tmdb.org/t/p/w500/oM6qEsT3xpBnefspmdcp3oTuhK7.jpg,61,0.0,0,0.0289,Lee Woo-dong,"Lee Woo-dong, Oh Yun-su, Park Kyung-man"
877301,만인의 연인,만인의 연인,2021-10-09,"엄마가 사랑에 빠져 집을 나가고,  열여덟 유진은 스스로 삶을 꾸려나가기로 한다.  피자 가게에서 아르바이트를 시작하며  유진은 새로운 사람들과 관계 맺는 법을 배워나간다. 특히, 그는 사랑 앞에 거침없고 대담하다.  유진을 둘러싼 환상이 깨지는 순간, 새롭게 발견할 세계는 어떤 모습일까?",드라마,South Korea,Cinema Dal,https://image.tmdb.org/t/p/w500/n8BhNybCdPMhGulFg2M4Jd0Oq3G.jpg,137,5.0,1,0.5071,Han In-mi,"황보운, 서영희, 전석호, 우지현"
877461,시인들의 창,시인들의 창,2021-10-10,실용성이 지배하는 세상입니다. 합리적인 일상입니다. 쓸모없는 물건을 만지작거리는 사람들이 있습니다. 그 물건을 만드느라 시간도 잊어버립니다. 때로는 영혼을 내어주기도 합니다. 바로 시인들의 일상입니다. 어느 날 시인의 창밖에 서 봅니다. 창안이 궁금합니다. 똑똑 조심스레 노크합니다. “뭘 하고 계시는가요?” 시인의 대답이 나지막이 번져 나옵니다. “알을 품고 있지요.”,다큐멘터리,South Korea,A- Jeon- In- Soo,https://image.tmdb.org/t/p/w500/ypdWpOTUALtOiuVd94SbVj0DKcD.jpg,70,0.0,0,0.0865,Kim Jeon-han,
877458,섬이없는지도,섬이없는지도,2021-10-10,"제주도의 자연과 접촉해 살아가는 사람들, 서늘한 역사를 간직한 채 각종 개발 사업과 국책 사업으로 황폐해져 가는 제주도의 땅을 지키려는 간절한 마음을 간직한 사람들, 살아갈 수 있는 사회를 만들고자 필사적으로 사회 운동을 해나가는 사람들의 애틋한 사랑 이야기다.",다큐멘터리,South Korea,,https://image.tmdb.org/t/p/w500/oCWLQibzlDd8U2iiiFO37gyn2hQ.jpg,91,0.0,0,0.2682,Kim Sung-eun,
877456,기국서의 배우수업,기국서의 배우수업,2021-10-10,"극단 76의 연출가 기국서와 배우들이 사무엘 베케트의 엔드 게임을 무대에 올리기 위해 연습에 돌입한다. 엔드 게임은 기국서의 동생이자 배우인 기주봉을 비롯해 노련하고도 훌륭한 배우들이 다 모인 공연이지만 연습 과정이 녹록지만은 않다. 무대와 관객, 배우들 사이의 감정선을 면밀히 분석하고 구축하는 연출가는 시시때때로 불호령을 내리고 배우들은 고뇌를 거듭한다.",다큐멘터리,South Korea,cinegut,,86,0.0,0,0.1636,Whang Cheol-mean,"Gi Guk-seo, 기주봉"
877406,올 겨울에 찍을 영화,올 겨울에 찍을 영화,2021-10-10,,,South Korea,,https://image.tmdb.org/t/p/w500/lHYotQJoSeeVDDdXhtAoDM1tue5.jpg,73,0.0,0,0.0941,Kim Kyung-rae,"James Chung, 박가영, Lee Yu-ha, Jun Se-won"
874537,세이레,세이레,2021-10-10,"아기가 태어난 지 얼마 안 된 초보 아빠 우진(서현우)은 현관문에 금줄을 쳐서 외부인의 출입을 막고, 금기사항을 철저히 지키는 아내가 이해되지 않는다. 회사 다니면서 틈틈이 육아를 도와주며 바쁜 일상을 보내던 어느 날, 우진에게 과거의 연인 세영(류아벨)의 부고 문자가 도착한다. 아기가 태어나고, 21일 동안은 장례식장에 가면 안 된다는 아내의 반대에도 불구하고 조심스레 다녀온 우진. 그날 이후, 아기가 아프기 시작하면서 불안과 두려움이 커져가는데…  아기가 태어나고 금기를 지켜야하는 21일의 기간, 세이레! 금기를 깬 아빠, 가족에게 보이지 않는 위험이 다가온다!","공포, 드라마",South Korea,,https://image.tmdb.org/t/p/w500/8HRSKyH65ZF4YD9VyG5HDB7vjvN.jpg,102,7.0,3,0.7183,Park Kang,"서현우, 류아벨, Sim Eun-woo, Ko Eun-min"
1016109,출사모델의 성욕,출사모델의 성욕,2021-10-12,,로맨스,South Korea,,https://image.tmdb.org/t/p/w500/11J8d8YqdzEPnE9NbCis6AXUlyH.jpg,70,0.0,0,0.8137,EROPING,"Yoon Yool, Yeon Joo, 민도윤"
478214,손오공: 대몽서유기,The Land of Many Perfumes,2021-10-12,"손오공, 저팔계, 사오정, 소백룡, 그리고 삼장법사는 서천으로 경을 구하러 가는 길에  전갈요괴의 술책에 빠져 서량여국(여아국)을 지나게 된다.  여성으로만 이루어져 남자가 귀한 여아국의 국왕은 삼장법사에게 첫눈에 반해 그를 왕비로 삼으려 한다.  하지만 평소 국왕에게 앙심을 품고 있던 전갈요괴는 그녀를 괴롭히기 위해 삼장을 취하고  엎친 데 덮친 격으로 기억을 잃은 손오공은 전갈요괴의 거짓말에 넘어가 삼장과 동료들을 공격하기에 이른다.  삼장법사는 여아국을 탈출해 모험을 이어나갈 수 있을까?",액션,,,https://image.tmdb.org/t/p/w500/ajqP7MNK0xeS3BB2mEYPM10V1VM.jpg,90,0.0,0,0.0362,,
1016106,오빠 한번 믿어봐,오빠 한번 믿어봐,2021-10-13,,로맨스,South Korea,,https://image.tmdb.org/t/p/w500/vwG2rVoKrrmnXA02Y9ZnnrWFvcY.jpg,74,0.0,0,0.3726,Kim Jong-seok,"Lee Sun-yoo, Yeon Joo, Han Seok-bong, James"
884034,뫼비우스,뫼비우스,2021-10-13,"1. 술과 족발과 케이크: 연극영화학과 새내기들이 기숙사에 모여 즐겁게 놀고 있다. 술을 마셔 시끌벅적한 가운데 유미, 예리, 수정, 설은 동기 은채의 깜짝 생일파티를 열어주려 몰래 움직인다. 그때, 누군가 '똑똑똑' 방문을 두드린다. 뜻하지 않은 손님에 이들의 생일파티 계획은 전혀 예상하지 못한 방향으로 흘러가게 된다. 2. 미래장: 여행 중 길을 잃고 여관 '미래장'을 찾게 된 현재. 그 안에서 투숙객 제이슨을 만나게 된다. 돈 대신 기억을 팔아햐 하는 미래장에서 현재는 지우고 싶었던 기억을 팔게 된다. 하나 둘 기억을 팔던 중 미래장에서 일하는 사람들에게 이상한 낌새를 느끼게 되는 현재. 미래장에서 도망치려 한다. 3. 다소니: 패션디자인과 졸업 후, 이곳 저곳에서 일을 하던 설. 그러다 미국에서 패션 일을 하고 있는 이모 밑에서 1년간 일을 하게 된다. 출국하기 하루 전, 7년동안 만나온 남자친구 기우와 함께 짐 정리를 한다. 4. 크리스마스 선물: 악플에 시달리던 연예인 여자친구가 자살을 하고, 그를 되돌리기 위해 여러가지 방법을 강구하다가 결국 방법을 찾아내고 다시 행복하게 살아가려고 한다.",드라마,,,https://image.tmdb.org/t/p/w500/9sB5Wan4mZ2DWdx9a75p1BanAY0.jpg,79,0.0,0,0.3587,이소연,"이정현, 공수호, 변지현, 안지혜"
883957,요시찰,요시찰,2021-10-13,"감옥. 8번 방에선 목사와 스님이 허구한 날 종교분쟁으로 시끄럽다. 그러던 어느 날.. 한 사람이 세상을 다 가진 듯 행복한 표정으로 8번 방에 들어온다. 그는 자신이 “신“이라 주장한다. 신이 감옥에 들어왔다? 삶과 죽음 종교와 사회 등등 어지러운 세상을 정리하러 왔다고 한다. 신이라는 사내의 입 밖으로 나오는 말들에 처음엔 그저 농담으로 생각하던 같은 방 사람들은 어딘가 이상한 것 같지만 논리 정연한 그의 답변들에 서서히 신빙성을 갖게 된다. 그때 또 다른 신이 방 안으로 들어온다. 얼굴만 봐도 누구나 아는 재벌 2세의 돈에 신. 너무 유명한 재계의 인물이 자신과 같은 방에 있으니 어찌할 바를 모르고 눈치만 보고 있는 방 사람들, 하지만 방안에는 진짜 신이 있다. 돈의 신과 진짜 신(?)의 기 싸움이 팽팽하다. 때문에 방안의 분위기는 살얼음 판.  그때 돈의 신에게 청천벽력 같은 소식이 전해진다. 아무리 많은 돈이 있어도 감옥 안에서는 무용지물, 큰 충격을 받고 혼이 나간 돈의 신. 그 모습을 지켜보던 신이 돈의 신에게 엄청난 제안을 하는데...","드라마, 코미디",South Korea,CMNIX,https://image.tmdb.org/t/p/w500/zi8aopsL8UyxOv945X86i9mUPBt.jpg,106,4.3,3,0.3093,Kim Sung-han,"오달수, Kim Jeong-wook, Akira Kim, Choi Min-seok"
1102884,국물은 공짜가 아니다,국물은 공짜가 아니다,2021-10-14,,드라마,South Korea,,https://image.tmdb.org/t/p/w500/nzIaJEATTZ2NfkHK8vaNESnPh2X.jpg,29,0.0,0,0.0517,강민아,"나애진, Kim Cha-yoon"
1036423,그녀의 가족은 잘못이 없어,그녀의 가족은 잘못이 없어,2021-10-14,"가족 뒷바라지에 지친 경숙을 지탱해주는 버팀목은 ´주님´ 뿐이다. 맹목적 신앙심을 가진 경숙으로 인해 가족은 늘 갈등한다. 백수 남편과 삼촌, 군생활에 적응 못한 아들, 반항적인 딸, 이 아슬아슬한 가족의 내일은 무사할까?",드라마,,,https://image.tmdb.org/t/p/w500/6fWyf33forAWDbZeAohV5EWi9cB.jpg,100,0.0,0,0.0143,,
900086,대물 : 한 집에 두 여자,대물 : 한 집에 두 여자,2021-10-14,가정형편이 어려워 원치않은 결혼을 하게된 유정.  남편 현식은 유정에게 지극정성을 다했지만 마음을 열지않은 유정에게 실망해  바람을피우게된다.. 그러던 어느날 현식은 자신의 내연녀인 미라를  집안으로 들이게되는데..,로맨스,South Korea,,https://image.tmdb.org/t/p/w500/eN4feZa0ECn6pz4VIOyMqebGj4m.jpg,70,0.0,0,0.3741,Kim Mo-ri,"Ye Ri, 이수, Hun-i, 우열"
874847,색다른 그녀,색다른 그녀,2021-10-14,"여자친구 ‘지연’과 결혼을 앞둔 완벽남 ‘완준’ ‘완준’은 사고뭉치 선배로부터 받은 부탁으로 ‘지연’에게도 말 못 할 은밀한 비밀을 갖게 된다. 어느 날, ‘완준’은 자신을 짝사랑하는 직장동료 ‘예리’에게 이 사실을 들키게 되고, 그녀와 뜻밖의 계약을 맺게 되는데… 갑자기 꼬여버린 인생! 무사히 결혼에 골인할 수 있을까?!","코미디, 로맨스",South Korea,,https://image.tmdb.org/t/p/w500/pz9V8h2OZxh0xK5f1RQ0lgH0wcx.jpg,108,7.0,1,0.239,Kim Jin-young,"한상혁, 장성윤, 최재환, 임도화"
854762,타다: 대한민국 스타트업의 초상,타다: 대한민국 스타트업의 초상,2021-10-14,"한국의 우버로 불리며 폭발적으로 성장하던 모빌리티 플랫폼 타다(TADA), 출시한 지 9개월 만에 100만 유저를 확보하며 승승장구하던 중 택시업계의 반발로 법적 공방에 휘말린다. 뜨거운 논란 속 치러진 1심에서 무죄 판결을 받은 날, 모든 팀원들은 함께 모여 종이컵 와인 파티로 자축한다. 하지만 그로부터 단 14일 뒤, 타다금지법이 통과됐다는 청천벽력의 소식이 들려오는데...",다큐멘터리,South Korea,Next Entertainment World,https://image.tmdb.org/t/p/w500/eI8R3dlOK1QdgcxYKKrXXRslIp7.jpg,91,0.0,0,0.1952,Gwon Myeong-guk,"Park Jae-uk, Han Ji-hyun, Kim Ki-yon, Lee Jung-haeng"
750646,노회찬 6411,노회찬 6411,2021-10-14,"시커메진 한국 정치의 판을 바꾸고자 했던 사람, 서민의 언어로 그들의 속을 시원하게 대변했던 사람, 함께 비를 맞으며 약자와 공감하고자 했던 사람, 법 앞에 만인이 평등하길 희망했던 사람, 누구나 악기 하나 정도는 다룰 수 있는 사회를 꿈꿨던 사람. 지금 더욱 그리운 이름, 노회찬의 진짜 이야기가 시작된다!",다큐멘터리,South Korea,"Myung Films, Jeonju International Film Festival, Roh Hoe-chan Foundation, Cinema 6411",https://image.tmdb.org/t/p/w500/tmucrq7CX3ZSi7E2OlQgXM2C2Bk.jpg,127,0.0,0,0.48,Min Hwan-ki,"노회찬, 심상정, 손석희, 유시민"
707157,십개월의 미래,십개월의 미래,2021-10-14,"스물아홉의 컴퓨터 게임 개발자 미래가 임신 사실을 알게 된 뒤부터 출산 때까지의 과정을 그린다. 미래는 시간이 지나면서 자신을 둘러싼 환경이 얼마나 출산에 비협조적인지 깨닫게 되는데, 그 상황은 때때로 VR 헤드기어를 낀 듯 너무도 생생하게 전해진다. 남자친구 윤호와 등 떠밀리듯 결혼을 추진하고, 사장에게 배신감이 든다는 소리를 듣고 회사에서 잘리며, 새로 취업도 되지 않아 “속았어, 온 세상이 나를 속이고 있어”라고 중얼거리는 미래의 모습은 너무나도 실감난다.","드라마, 코미디",South Korea,"GREEN NARAE MEDIA, Korea National University of Arts",https://image.tmdb.org/t/p/w500/tDqEenntPdR623eEz7wkaroBS9R.jpg,95,6.65,10,0.5919,남궁선,"최성은, 서영주, You E-den, 백현진"
660345,더 판타스틱,The Fantastic,2021-10-15,"밀반입된 할리우드 영화를 본 경험을 들려주는 새터민들의 인터뷰를 바탕으로 하고 있는 이 영화는 실험 다큐멘터리 형식을 빌어, 현실은 어떻게 정의되고 우리는 무엇을 믿고 싶은지에 대해 의문을 던진다. (평창국제평화영화제)",다큐멘터리,"China, Finland, South Korea","Häivekuva Oy, YLE",https://image.tmdb.org/t/p/w500/qRwedgr9ntiH96HAQrbCIQpq0QB.jpg,30,6.0,1,0.2018,Maija Blåfield,"Maija Blåfield, Taedeog Ghim, Solha Kim"
921176,키스반 양념반,키스반 양념반,2021-10-16,,,,,https://image.tmdb.org/t/p/w500/xxPBAAVbaWNESmkpbi9UW1L76zs.jpg,16,5.0,1,0.0261,Park Jong-won,"Park Yoon-hwan, 한상길"
913540,원수는 우리집 거실에서 만난다,원수는 우리집 거실에서 만난다,2021-10-16,,,,,https://image.tmdb.org/t/p/w500/wJnbALsQIGDyvcVLJCEAmXeiceS.jpg,17,0.0,0,0.0331,Joo Chan,
897248,완성과 미완성의 사이,완성과 미완성의 사이,2021-10-16,,"드라마, 로맨스",,,https://image.tmdb.org/t/p/w500/jsiOr1fMGDkLElv4G1PngoKcaNP.jpg,19,8.0,1,0.2104,Donghyuk Shin,"Kim Young-pyo, Roh Young-joo, Yohan Lim, Crystal Cho Jones"
602295,유체이탈자,유체이탈자,2021-10-17,"교통사고 현장에서 눈을 뜬 한 남자. 거울에 비친 낯선 얼굴과 이름, 자신이 누구인지 기억이 나지 않는다.  잠시 후, 또 다른 사람의 몸에서 깨어난 남자. 그는 12시간마다 몸이 바뀐다는 사실을 깨닫게 되고, 자신을 둘러싼 사람들 사이의 연결고리를 찾기 시작한다. 모두가 혈안이 되어 쫓고 있는 사람이 바로 자신임을 직감한 남자, 자신을 찾기 위한 사투를 시작하는데…","액션, 미스터리, 스릴러, 판타지",South Korea,"BA Entertainment, Saram Entertainment, Plus M Entertainment, ABO Entertainment",https://image.tmdb.org/t/p/w500/jsJluzrVEkQBYYkTNj3FQJ0LkAM.jpg,108,6.3,73,2.1464,Yoon Jae-geun,"윤계상, 박용우, 임지연, 유승목"
1016103,섹스를 달리는 비행소녀,섹스를 달리는 비행소녀,2021-10-18,,로맨스,South Korea,,https://image.tmdb.org/t/p/w500/j7fsr7QL6GIkkTjHz4Y82XK3A5S.jpg,70,0.0,0,0.809,EROPING,"Yoon Yool, 민도윤, Im Tae-mok, So Ra"
1036752,웨스트사이드스토리-디오리지널,웨스트사이드스토리-디오리지널,2021-10-19,웨스트사이드스토리-디오리지널,,,,https://image.tmdb.org/t/p/w500/3F3OP1apeCv2lsCZwAY0BrBhOBK.jpg,0,10.0,1,0.0143,Patrick Ray Gallows,Tina Walalce
930114,자매사육：캠핑에서 생긴 일,자매사육：캠핑에서 생긴 일,2021-10-19,"한적한 어느 캠핑장. 이곳에 캠핑 온 사람들 중 몇몇이 사라지곤 한다. 어느 날 캠핑장으로 자매가 놀러 온다. 피가 뚝뚝 떨어지는 생고기를 썰어 먹는 주인은 캠핑 온 자매에게 관심을 갖는다. 주인 만수는 친절하게 음식도 따로 챙겨주고, 지저분한 공용 화장실이 아니라 집으로 와서 편하게 쓰라고 한다. 신나게 놀다 갈 목적으로 코 삐뚤어지게 술을 먹고 잠든 자매, 그런데 아침이 되고 텐트 안에는 동생 유진만 남아 있고 언니 영옥이 사라져 버렸다. 주인에게 잡혀 감금당한 영옥은 한 끼도 빠짐없이 생고기만 먹게 되고, 혼자 남게 된 동생 유진은 두려움에 떨기 시작한다.",로맨스,South Korea,,https://image.tmdb.org/t/p/w500/mEIfQtdHV9YEQscFZHvwddTAMAG.jpg,72,10.0,1,1.2297,Han Dong-Ho,"So Ra, Ji Hee, Yoon Taek-seung, 우열"
895713,윤율아씨의 쓰리쿠션,윤율아씨의 쓰리쿠션,2021-10-19,어느 날 갑자기 당구장에 나타난 미모의 알바생 두명.  해맑은 성격의 제니퍼와 그녀를 옆에서 지켜주며 보호하는 에마.  사실 둘의 진짜 정체는 조선시대 공주였으나 저주에 걸려 현재로 타임슬립한것!  하지만 이제 딱 3일 안에 남은 2번의 기회 동안 자신을 위해 울어줄 남자를 만나 합궁을 해야 원래 살던 시대로 돌아갈 수 있다.  그렇지 못하면 결국 여기서 소멸하게 되는데.,로맨스,,,https://image.tmdb.org/t/p/w500/jlr2BIP1Wed72nYaVa9FcXU22tu.jpg,67,0.0,0,0.0286,,
1016100,보안 노출,보안 노출,2021-10-20,,로맨스,South Korea,,https://image.tmdb.org/t/p/w500/kFJxxGeIsIne4RaBLOnXke6UyXR.jpg,69,0.0,0,0.3673,Richard Kim,"Ye Ri, James, 유정, Byun Ji-ho"
