영화 ID,제목,원제,개봉일,줄거리,장르,국가,제작사,포스터 URL,러닝타임,평점,투표수,인기도,감독,주연
706066,홈리스,홈리스,2022-09-15,"어린 부부 '한결'과 '고운'은 아들 '우림'과 함께 찜질방을 전전하며 살고 있다. 어느 날, 우림이 크게 다치게 되고 한결은 병원비를 구하기 위해 배달 일을 하며 알게 된 할머니의 빈집으로 들어선다.","드라마, 가족",South Korea,"GREEN NARAE MEDIA, DGC, Tiger Cinema",https://image.tmdb.org/t/p/w500/70PorWCcWXItvxLy8Hdobea0itd.jpg,83,5.8,4,0.7234,Lim Seung-hyeun,"Jeon Bong-seok, 박정연, Sin Hyeon-seo, Song Gwang-ja"
992831,섹스 셰어하우스,섹스 셰어하우스,2022-09-19,"아버지의 소개로 찾아 간 셰어하우스.  지훈은 달라붙는 여주인의 폭신한 가슴에 괜스레 마음이 설렌다.  늦은 밤, 들려오는 신음 소리에 잠에 서 깬 지훈은 집을 둘러보다  믿을 수 없는 장면을 목격하게 되는데...",,,,,0,0.0,0,0.3383,,"Sae Bom, Lee Jae-hee-II"
962931,썬더버드,썬더버드,2022-09-21,"강원도 정선. 택시 운전사 태균은 동생 태민에게 받을 돈이 있다. 태민과 연락이 되지 않아 초조하던 차에 걸려온 전화. 태민은 전당포에 맡긴 자동차 썬더버드를 찾아야 한다며 태균에게 도움을 청한다. 태균과 태민, 그리고 태민의 여자친구 미영까지, 세 사람은 차를 찾으러 나선다.","스릴러, 범죄, 드라마",South Korea,M-Line,https://image.tmdb.org/t/p/w500/clfg0X086rH75ePdLQRE7medQV7.jpg,97,4.2,4,0.2773,Lee Jae-won,"서현우, 이설, Lee Myeong-ro, Yoon Sung-won"
799379,늑대사냥,늑대사냥,2022-09-21,"동남아시아로 도피한 인터폴 수배자들을 이송할 움직이는 교도소 프론티어 타이탄. 극악무도한 이들과 베테랑 형사들이 필리핀 마닐라 항구에 모이고 탈출을 꿈꾸는 종두, 한국으로 돌아가야만 하는 도일을 비롯해 이들은 각자의 목적과 경계심을 품고 탑승한다. 한국으로 향하던 중, 태평양 한 가운데에서 이들에게는 지금까지 보지 못한 극한의 상황과 마주하게 되는데…","액션, 스릴러, 공포, 범죄",South Korea,"The Contents On, Contents G, Cheum Film, Finecut",https://image.tmdb.org/t/p/w500/op2y1gvqKhAh4yAPLwc4PlX3XRv.jpg,122,6.4,387,8.2168,김홍선,"서인국, 장동윤, 박호산, 정소민"
629273,프린세스 아야,프린세스 아야,2022-09-21,"동물로 변하는 저주를 가진 아이들이 태어나는 연리지 왕국. 연리지의 공주 ‘아야’(백아연)는 어린 시절 엄마가 남겨주신 신비로운 힘을 가진 팔찌로 정체를 숨기며 산다.  이웃나라 바타르가 강력한 군사력으로 영토를 확장하며 주변국들을 위협하자 ‘아야’는 연리지를 지키기 위해 얼굴도 모르는 바타르의 왕자 ‘바리’(박진영)와 정략결혼을 결심한다. 한편, 바타르의 장군 ‘섭정’은 왕자를 제거하고 전쟁을 일으키려는 음모를 꾸미는데…  저주의 비밀을 풀고 평화를 지키려는 ‘아야 공주’와 전쟁을 막고자 하는 ‘바리 왕자’의 운명을 넘어선 환상적인 모험이 펼쳐진다!","애니메이션, 판타지, 드라마, 로맨스",South Korea,"Studio Dadashow, RedPeter Films, CGV Arthouse",https://image.tmdb.org/t/p/w500/8QfxR4GNNLy5SC8F7wkrfKPs3fM.jpg,90,5.0,1,0.4754,Lee Sung-gang,"백아연, 진영"
1108949,이것은 보이는 것과 다르다,이것은 보이는 것과 다르다,2022-09-22,,,,,https://image.tmdb.org/t/p/w500/zt8MZ2zbZKrfgkCd0dCpKXQhrbZ.jpg,20,0.0,0,0.0741,Heehyun Choi,
1041630,The Mischievous Pants,The Mischievous Pants,2022-09-22,,애니메이션,South Korea,,,4,0.0,0,0.0071,Lee Jong-hoon,
1027467,인 드림즈,인 드림즈,2022-09-22,"지우의 꿈(Want), 바이올리니스트가 되어 인기 피아니스트 재영과 합주하는 일.  지우의 꿈(Dream), 과거의 지우를 도와주며 자신을 찾아달라고 말하는 꿈속의 한 남자.  어느 날 지우 앞에 자신을 `몽신`이라 칭하는 미스터리한 존재가 나타난다.  한 남자가 등장하는 꿈(Dream)을 팔면 지우의 꿈(Want)을 이뤄주겠노라며 꿈 거래를 제안하는 몽신.  지우는 몽신과의 거래가 이루어질 때마다 꿈(Want)에 한 걸음씩 가까워지고,  동시에 꿈속 한 남자에 대한 단서도 하나씩 얻게 된다.  그러자 그 단서들이 말한다.  지우 곁에 있는 세 남자, 서진-우빈-재영 중 한 사람이 바로 꿈속의 그 남자라고.  과거와 현재, 미래를 잇는 꿈의 퍼즐 조각이 맞춰지기 시작한다!","로맨스, 판타지, 드라마",South Korea,,https://image.tmdb.org/t/p/w500/u0XofaBsNgiKkJmp2181Vwi5GHj.jpg,83,5.0,1,0.0813,Donghwi Kwon,"Park Si-an, 차지혁, Lee Jong-wook, Jaehyuk Jeong"
1022082,기기묘묘,기기묘묘,2022-09-22,"땅을 둘러 싼 이웃들의 다툼,  엄마와 딸의 기이한 관계,  낙향한 청년과 괴인의 기묘한 만남,  아들 세대의 암울한 미래를 직감한 아버지의 고군분투기  불안한 사회, 불안한 사람들을 소환한 판타스틱 스릴러",공포,,,https://image.tmdb.org/t/p/w500/argZe1P4Vc9xLnnforH7eXxZzr0.jpg,116,5.3,3,0.7975,Lee Tack,"오민애, 김재화, 한해인, 이양희"
742734,달이 지는 밤,달이 지는 밤,2022-09-22,"중년의 여인이 무주 시외버스 터미널에서 내린다. 그녀는 마을길을 지나 숲으로 들어간다. 숲 어디선가 방울 소리가 들리고 여인은 자신이 목적지에 도착했음을 느낀다. 여인은 죽음 너머 삶의 흔적들을 찾기 시작한다. 한편, 서울에서 학교를 마치고 고향인 무주로 돌아와, 군청에서 일하며 혼자가 된 엄마와 살고 있는 민재. 엄마는 민재가 다시 고향으로 돌아온 것이 못마땅하다. 민재의 오랜 고향 친구이자 애인인 태규는 편찮으신 할머니를 간병하며 조부모의 오래된 집을 지키면서 살고 있다. 어느 날 한동안 연락이 끊겼던 대학 친구 경윤이 민재를 찾아온다.  떠난 사람들과 남은 사람들 그리고 다시 돌아온 사람들.  당신을 위로할 두 가지 아름다운 이야기",드라마,South Korea,Muju Film Festival,https://image.tmdb.org/t/p/w500/zZGMubumqpFy95xI794RRvEtC3w.jpg,76,6.5,4,0.929,김종관,"김금순, 안소희, 강진아, 곽민규"
1031264,꿈을 뒤덮은 먼지,From Dreams to Dust,2022-09-23,폴라는 인도네시아의 니켈 광부이자 가장이다. 그는 가족을 먹여 살리기 위해 매일 목숨을 걸고 광산에 들어가며 아이들의 미래를 위해 자신의 꿈을 버린다. 지난 10년 동안 그의 마을은 목가적인 어촌에서 니켈을 캐내는 먼지 뒤덮인 붉은 땅이 되었다. 니켈은 친환경 제품으로 알려진 전기자동차에 사용되는 재생 배터리의 핵심 구성요소다. 우리는 폴라의 눈을 통해 친환경 기술의 어두운 면을 본다.​,다큐멘터리,"United States of America, Indonesia",,,9,0.0,0,0.0995,Stephanie Tangkilisan,
1031255,비상구 있는 집,비상구 있는 집,2022-09-23,"오랜 시간 동안 장애인 거주시설에서 살다가 2020년에 ‘탈시설’ 하여 관악구 신림동에 거주하고 있는 두 명의 발달장애인에 관한 영화. 한 문장으로 정리된 이들의 독립 과정에는 사건·사고가 잦았다. 두 인물이 지역사회에 속해 독립적으로 사는 현재, 그리고 그들이 시설의 통제된 환경에서 거주했던 과거가 서로 마주하도록 하여 인간적인 삶의 가치를 조명해보고자 한다.​",다큐멘터리,South Korea,,,60,0.0,0,0.0071,Jang Ju-yeong,
1031254,뼈,뼈,2022-09-23,"이 이야기는 북부 아키타 지역의 조선인 강제동원자를 기억하기 위해 40년이 넘는 세월을 고군분투해온 두 사람에 관한 것이다. 본인의 탁월한 능력과 전후 일본의 경제성장 덕분에 사업가로 성공한 재일교포 하정웅, 일본 북부 아키타 지방에서 공동체 문화마을을 일궈온 일본 비주류 사학자 차타니 쥬로쿠. 다자와 호수에 세워진 히메관음상의 비밀을 풀고 조선인 강제노역 피해자를 추모하기 위한 그들의 노력은 지금도 계속되고 있다.​",다큐멘터리,South Korea,,https://image.tmdb.org/t/p/w500/r684Ee8cHFMW7RfDfTjisnI9bSB.jpg,69,0.0,0,0.0071,신나리,
1031241,노 웨이 아웃,노 웨이 아웃,2022-09-23,"고용허가제가 실시된 지 18년이 됐고 많은 이주노동자가 꿈을 이루기 위해 이 제도를 통해 한국 땅을 밟았다. 하지만 고용허가제에는 사업장 변경의 자유가 없고, 이는 노동환경 개선을 위한 행동을 봉쇄하는 구조를 만드는 데 기능한다. 그리고 폭력적이고 억압적인 고용관계 속에서 이주노동자의 꿈은 현실의 벽에 부딪힌다. 치열하게 노동자의 삶을 살아가는 세 명의 이주노동자가 자신들의 이야기를 시작한다.​",다큐멘터리,South Korea,,https://image.tmdb.org/t/p/w500/jMNikeYDutgAtYEMS5WYkDHFF23.jpg,61,0.0,0,0.0434,섹 알 마문,
1030591,바다의 극장,바다의 극장,2022-09-23,"시인 재호는 현실 세계에서는 더이상 시를 쓸 수 없어 사이버 세계에 들어가게 되고, 15년 전에 알던 주연을 거기서 만난다. 재호는 사이버 세계에 기대를 잔뜩 품었지만 적응하지 못하고, 주연은 재호에게 사이버 세계의 법과 규칙, 생활양식을 가르친다. 그 가운데 그들은 자신들이 밖으로 밀어낸 중요한 기억을 발견한다. 그 기억은 사이버 세계 바다를 흘러 다니는 파일이다. 그리고 그것은 재호 자신이지만 회피해야만 하는 무엇이다.​",다큐멘터리,South Korea,,https://image.tmdb.org/t/p/w500/bVZdEMvog7rbrK1GGIhiQk1wM8a.jpg,90,0.0,0,0.1098,Kim Eung-soo,
1031253,"엄마, 영순","엄마, 영순",2022-09-24,영순은 2007년 탈북했다. 남편은 자살했고 두 아들 중 큰아들은 북한에 있다. 그녀는 같이 온 작은 아들을 위해 최선을 다한다. 그러나 작은아들은 엄마가 북한에서는 형에게만 사랑을 주고 자신을 내팽개쳤으며 이제는 남한에 데려와서 탈북자로 낙인찍히게 했다고 미워한다. 영순은 북한에 억류된 국군 포로의 딸로 태어나 늘 가난했고 유일한 희망은 재능이 특출했던 큰아들이었다. 영순에게 작은아들은 희망 대신 숙제다.​,다큐멘터리,South Korea,,https://image.tmdb.org/t/p/w500/uEgxu9LIpNcHibh7ovK2L1CFKmI.jpg,85,0.0,0,0.1024,Lee Chang-jun,
1031252,해체: 바다의 몸,해체: 바다의 몸,2022-09-24,"어느 낮, 어떤 바닷가. 여느 때처럼 여러 고양이가 여유롭게 노니는 땅. 그곳을 삶의 전부로 삼고 있는 한 부부가 뭍에 올린 한 척의 배를 두 사람의 힘만으로 해체하려고 한다. 점차 도려지는 선박 사이에는 불꽃과 연기로 빚어진 노동만이 아니라 사려 깊은 거리감으로 마주한 인간과 고양이들의 생도 함께 존재했다. 서로를 지켜보며 지켜온 인간과 작은 생명들은 그렇게 함께 살아가고 있다.​",다큐멘터리,South Korea,,,92,0.0,0,0.0071,Park Koon-je,
1030592,땅에 닿지 않는 비,땅에 닿지 않는 비,2022-09-24,"아시아 국가 간 빈부격차가 심해지고 이주노동이 확산되는 과정에서 새로운 사회갈등이 대두되었다. 빈곤한 삶을 극복하고자 국경을 넘은 어른들에게 닥친 열악하고 부당한 환경은 이제 그 아이들에게로 이어지고 있다. 그들은 대만에, 필리핀에, 태국에, 말레이시아에, 인도네시아에, 또 다른 어딘가에 있지만, 그 어느 국가에도 없다. 이 영화는 그림자 같은 인생을 살고 있는 불법체류인 2세, 미등록 이주 아동들에 관한 이야기다.​",다큐멘터리,South Korea,,,75,0.0,0,0.0143,Won Ho-yeon,
1049190,기억으로 만든 집: 이향정,기억으로 만든 집: 이향정,2022-09-26,,"애니메이션, 다큐멘터리",,,,17,0.0,0,0.0168,Lee Sung-hwan,
1026093,이진혁 : 애프터 사이트,이진혁 : 애프터 사이트,2022-09-26,이진혁의 다섯 번째 앨범 준비 과정과 이진혁의 생각들을 들려주는 코멘터리 필름,,,,https://image.tmdb.org/t/p/w500/c4nAUddC3uhXfm3keQYXHmzVQK6.jpg,29,0.0,0,0.0,,
1210956,금의위: 황금 도난사건,盗金者,2022-09-27,"당룡삭 원년의 진양성에서 번속 사신 10만 냥의 황금 조공이 기이하게 도난당했고, 호금교위 임일남이 명령을 받들어 추적했습니다.몇 차례의 사투를 벌인 후, 린이난은 성공적으로 진양성의 위기를 해결하고 잃어버린 금을 되찾았으며, 늑대를 고용하여 절도의 배후 진범을 찾아내어 체포하여 재판에 회부했습니다.",,,,https://image.tmdb.org/t/p/w500/4BdgzFj4ZE1Hd1vibHOdbVWC2CJ.jpg,87,0.0,0,0.0168,,
1024649,극장판 헬로카봇: 수상한 마술단의 비밀,극장판 헬로카봇: 수상한 마술단의 비밀,2022-09-28,"할아버지 댁으로 휴가를 떠난 차탄과 가족들!  그곳에서 만난 매력만점의 새로운 친구 ‘삼순’과 함께 즐거운 시간을 보낸다.  그때, 할아버지가 키운 명품 수박들이 사라지는 사건이 일어나고  범인은 바로 마을에 자리 잡은 수상한 마술단?  그들이 노리는 것은 바로 수박 에너지!  지구 정복을 노리는 수상한 마술단에 맞서  차탄과 카봇 그리고 새로운 친구 ‘삼순’은  초특급 한판 승부를 벌이게 되는데…!",애니메이션,,,https://image.tmdb.org/t/p/w500/lndOP58GOT50xfSxY8RTcDd2NXp.jpg,79,0.0,0,0.1495,Lee Seul-gi,
1013346,고고다이노 극장판: 얼음공룡의 비밀,고고다이노 극장판: 얼음공룡의 비밀,2022-09-28,"렉스, 토모, 비키, 핑이 지키고 있는 평화로운 우르르 행성에 악당 제니와 미스터 블랙이 나타났다!  공룡 마니아 제니는 우르르 행성의 공룡들을 납치하기 시작하고, 전투 중인 ‘핑’도 결국 잡혀간다.  막강해진 제니와 미스터 블랙을 막기 위해 고고다이노 대원들은 전설의 공룡을 찾아가게 되고,  최강 합체 로봇인 ‘고고킹 다이노’로 변신할 수 있는 다이노 스톤을 얻게 된다!  하지만, 위기감을 느낀 미스터 블랙과 제니는 잠들어 있던 어둠의 얼음공룡을 깨우고 마는데…!  얼음왕국의 위기에 빠진 우르르 행성!  고고다이노 대원들은 ‘핑’과 공룡들을 구하고, 우르르 행성을 지킬 수 있을까?",애니메이션,,,https://image.tmdb.org/t/p/w500/pHcLlz97ZrBLWQ5WZZ5t6rLUuPX.jpg,74,0.0,0,0.0532,Lee Sun-myung,
877440,성덕,성덕,2022-09-28,"TV 예능프로그램에 아이돌 가수의 ′덕후′로 출연한 십대 소녀는 자신을 ′성덕′(성공한 덕후)이라 자처했다. 같은 프로그램에 그의 스타가 출연했기 때문이다. 몇 년 뒤 그의 스타는 성관계 장면 불법 촬영 및 유포, 집단 성폭행 혐의로 구속되었다. 졸지에 범죄자-스타의 팬이 된 성덕은 분노인지 슬픔인지, 여하튼 혼란스러운 감정 속에 범죄자가 된 스타의 팬들을 만나보기로 한다.",다큐멘터리,South Korea,Haerangsa,https://image.tmdb.org/t/p/w500/lAHAVHzuzi66rRMJMCrKvZxdIlc.jpg,87,5.5,2,0.1484,Oh Se-yeon,Oh Se-yeon
809677,물방울을 그리는 남자,물방울을 그리는 남자,2022-09-28,침묵과 고독으로 가득한 그의 세상에는 기묘한 균열이 존재한다.  자신의 아버지이자 같은 예술가인 인간 김창열을 이해하기 위해 카메라를 든 아들은 그리움의 시간을 살다 간 그의 삶을 담는다.,다큐멘터리,"France, South Korea",,https://image.tmdb.org/t/p/w500/m9G3nvPgKkFL1m5LbC4rpCqybSk.jpg,79,8.5,2,0.0585,김오안,Kim Tschang-yeul
795276,정직한 후보 2,정직한 후보 2,2022-09-28,"서울시장 선거에서 떨어지며 쫄딱 망한 백수가 된 주상숙은 우연히 바다에 빠진 한 청년을 구한 일이 뉴스를 타며 고향에서 화려한 복귀의 기회를 잡는다. 하지만 정직하면 할수록 바닥으로 곤두박질치는 지지율 앞에 다시 뻥쟁이로 돌아간 그 순간, 주상숙에게 운명처럼 찾아온 진실의 주둥이! 이번엔 주상숙의 비서실장 박희철까지 주둥이가 쌍으로 털리게 되는데...",코미디,South Korea,"Soo Film, Hong Film, Next Entertainment World",https://image.tmdb.org/t/p/w500/jQotnmACkRfxiITgdKaAEZS5pyZ.jpg,106,6.4,14,1.4141,Jang Yoo-jung,"라미란, 김무열, 윤경호, 서현우"
616670,인생은 아름다워,인생은 아름다워,2022-09-28,무뚝뚝한 남편 진봉과 무심한 아들딸을 위해 헌신하며 살아온 세연은 어느 날 자신에게 시간이 얼마 남지 않았다는 것을 알게 된다. 한치 앞도 알 수 없는 인생에 서글퍼진 세연은 마지막 생일 선물로 문득 떠오른 자신의 첫사랑을 찾아달라는 황당한 요구를 한다. 막무가내로 우기는 아내의 고집에 어쩔 수 없이 여행길에 따라나선 진봉은 아무런 단서도 없이 이름 석자만 가지고 무작정 전국 방방곡곡을 누빈다. 시도 때도 없이 티격태격 다투던 두 사람은 가는 곳곳마다 자신들의 찬란했던 지난날 소중한 기억을 하나 둘 떠올리는데...,"음악, 드라마, 로맨스",South Korea,The LAMP,https://image.tmdb.org/t/p/w500/pZG6SMsRij6MHeRa9wjUAxneDei.jpg,122,6.7,18,2.2978,최국희,"류승룡, 염정아, 박세완, 옹성우"
1043609,Kibitz,Kibitz,2022-09-29,,애니메이션,,,,0,0.0,0,0.0,KIM Il-hyun,
1024652,주연,주연,2022-09-29,"작은 분식집을 운영하는 부모님과 평범하지만  행복한 하루를 보내는 주혁(김대건)과 주연(민도희).  어느 날, 살인사건이 발생했다는 소식과 함께 주연이 행방불명 되고,  사라진 주연의 흔적을 쫓을수록 주혁은 알 수 없는 진실들을 마주하게 된다.","미스터리, 가족",South Korea,Mano Entertainment,https://image.tmdb.org/t/p/w500/y5F26ioGIiYR5QlBLHX70EsjojP.jpg,0,5.0,2,0.538,Song Won-jun,"민도희, 김대건, 길해연, Park Seo-eun"
921461,2차 송환,2차 송환,2022-09-29,"2000년 남북화해시대를 맞아 63명의 간첩 출신 장기수가 북으로 송환됐으나, 전향 장기수들은 명단에서 제외됐다. 2001년 이들은 ‘전향무효선언’을 하고 2차 송환 운동을 전개한다. 좌우 대립이 심각한 남한 사회의 정치적 현실 속에서 북의 고향으로 돌아가고 싶어 하는 전향 장기수들의 희망과 절망, 30년간 그들을 지켜본 감독의 시선으로 전개되는 휴먼 스토리.",다큐멘터리,South Korea,,https://image.tmdb.org/t/p/w500/q2odIe6i6UF7Vc3XdEcTUnULpg6.jpg,156,0.0,0,0.2927,김동원,
897135,애프터 미투,애프터 미투,2022-09-29,"미투 운동이 한국 사회를 거세게 뒤흔든 지 3년, 우리 사회는 얼마나 달라졌을까. 백래시와 남성 연대의 힘은 여전하고, 가부장제와 성차별 구조는 공고하기만 한 현실 속에서, 이 질문들은 온전히 그 답을 찾을 수 있을까. 동시대를 함께 살아가는 여성들의 일상과 목소리를 통해 미투 운동이 남긴 질문과 가능성을 탐색한다.",다큐멘터리,South Korea,gram FILMS,https://image.tmdb.org/t/p/w500/hhG53z8dbq1HX0FCdx7uaFYuTv6.jpg,84,8.0,2,0.2759,Park So-hyun,
1391166,알은 척 아는 척,알은 척 아는 척,2022-09-30,"영화를 공부하는 시봉은 모르는 영화가 너무 많다.  다른 학생들의 눈치에 못 이겨, 시봉은 수업시간 모르는 영화를 아는 척 손 들게 된다.",코미디,South Korea,,https://image.tmdb.org/t/p/w500/mTY57gARUOYnvYQytEH9GOxv1be.jpg,17,0.0,0,0.0962,이준우,"임경훈, Ha Jun-ho, 정우진"
1387583,온몸으로설계하는D컵보험왕,온몸으로설계하는D컵보험왕,2022-10-01,,,,,,71,0.0,0,0.2627,,"Ye Ri, 이수"
1097567,"Goodbye, Drama!","Goodbye, Drama!",2022-10-01,,애니메이션,,,,7,0.0,0,0.0,Ji-hye Min,
1069065,하루,하루,2022-10-01,"외모에 대한 강한 강박증으로 매일 체중계 앞에 서며 365일 다이어트를 하는 A(20대, 여). 하지만 A가 하는 다이어트는 건강한 방법이 아닌 음식을 먹고 토를 하여 몸에 무리는 주는 방식이다. 먹고 있지만 위는 비어있는 A는 음식에 대한 강한 집착으로 하루에도 몇 번씩 반복적으로 배달음식을 시킨다. 그런 반복적인 주문을 받고 음식을 배달해주는 배달원 B(30대, 남). 하루하루 힘들게 삶을 이어가지만 반복되는 A의 주문으로 더욱 더 고단함을 느끼게 된다. 같은 공간에 있지만 극명하게 다른 두 사람의 삶이 보여지는데..",,South Korea,,https://image.tmdb.org/t/p/w500/oYy9iUdGBAwh0lzIFteYfMWLVYV.jpg,0,0.0,0,0.077,Seo Ha-neul,
1053137,검은짐승,검은짐승,2022-10-01,"팬데믹이 일상이 되어 버린 근미래.  시체 수거반으로 일하는 '새운'은 시체를 매장하는 작업을 하다 죽은 줄로만 알았던 '유원'을 구출해 낸다.  '유원'은 '새운'의 도움으로 몸과 마음을 회복해 가며 잘린 한쪽 손을 되찾으려 하지만, 살아남은 '유원'을 세상은 가만히 내버려 두지 않는데…  이 끔찍한 현실의 결말은 무엇일까?",,South Korea,,https://image.tmdb.org/t/p/w500/vGuL5eXVG2MA16tDoohuH8Go7xI.jpg,86,5.0,2,0.0261,Hwang Ha-min,
1029084,악에 바쳐,악에 바쳐,2022-10-01,"한순간 나락으로 떨어져 버린 남자, 처음부터 잃을 게 없던 여자, 그 둘은 나락의 끝에서 서로의 삶을 마주하게 되는데..",드라마,,,https://image.tmdb.org/t/p/w500/oPMd6iPyvnaGfj9EQlamVVDZx6r.jpg,115,4.7,3,0.3531,Seewoo Kim,"박유천, Song Wook-kyung, Lee Jin-ri, 정상훈"
1199317,변이,변이,2022-10-02,"평화로웠던 일상에 들이닥친 바이러스의 출몰. 주인공 종찬은 이사를 하고, 부장으로서의 다시 평범한 회사생활을 하던 중, 부하직원 화선의 이상한 변화를 감지하게 된다. 이러한 이상한 상황을 파헤치기 위해 종찬은 화선을 주의깊게 보기 시작했지만, 결국 자신도 똑같이 화선과 같은 내면의 변화를 일으키게 된다.",드라마,,,https://image.tmdb.org/t/p/w500/snxi4BCI2Ky5HEilAK2Rszdn88O.jpg,40,0.0,0,0.0239,서하늘,
1197948,여름빛 쏟아지면,여름빛 쏟아지면,2022-10-04,,"드라마, 로맨스",,,https://image.tmdb.org/t/p/w500/3mh6wSXthn2EfBisRWqdUW8FHmA.jpg,26,6.0,2,0.0605,Yang Eun-chae,"Kim Jae-eun, Lee Ye-in"
1037700,Butch Up!,Butch Up!,2022-10-04,"""불행하게 살지마."" 전애인의 마지막 말을 듣고, 충격을 받은 인디 밴드의 메인 보컬 미혜. 미혜는 이제 밴드의 메인 곡 <오빠의 여자>를 더는 부를 수가 없다.",로맨스,South Korea,,https://image.tmdb.org/t/p/w500/kEn0zmtzx9WwTR9DMxkgWEbFH0s.jpg,12,0.0,0,0.0683,Lee Yu-jin,"Kwon Eun-hye, 최해준"
1087518,엑스칼리버 더 뮤지컬 다큐멘터리 : 도겸의 찬란한 여정,엑스칼리버 더 뮤지컬 다큐멘터리 : 도겸의 찬란한 여정,2022-10-05,,"음악, 다큐멘터리",South Korea,EMK Musical Company,https://image.tmdb.org/t/p/w500/edf662U1MScYXMDGBydqEwUQ486.jpg,95,10.0,2,0.1593,오윤동,도겸
1028678,에이비식스 : 테이크 어 챈스,AB6IX : TAKE A CHANCE,2022-10-05,"AB6IX 가 새롭게 발매한 앨범에 대한 인터뷰, 제작기",다큐멘터리,,,https://image.tmdb.org/t/p/w500/skRs4wR8NP3VFKskfS4P2QSXAjC.jpg,54,0.0,0,0.0377,,"Park Woo-jin, 이대휘, Kim Dong-hyun, Jeon Woong"
817557,컴백홈,컴백홈,2022-10-05,"개그맨이 되겠다는 꿈 하나로 서울 상경을 결심한 '기세'. 그러나 갑작스러운 프로그램 폐지 소식과 함께 꿈도, 돈도, 집도 하루아침에 모든 것을 잃게 되고 15년 만에 고향을 찾는다. 고향에서 만난 충청도 최대 조직의 삼촌 '강돈'은 현금 20억과 함께 기세에게 솔깃한 제안을 하고 기세는 다시 행복한 인생 역전을 꿈꾼다. 한편, 오랜 기억 속 첫사랑 '영심'까지 만나게 되면서 기세는 매일매일 예측불허한 사건들에 휘말리게 되는데...  20억과 함께 찾아온 조폭 상속의 기회! 거기에 첫사랑까지?  꼬일 대로 꼬인 인생, 조폭 두목을 상속받는다.","코미디, 드라마",South Korea,"JNC Media Group, WiseWolf Co",https://image.tmdb.org/t/p/w500/yaUW9NSozz7XNDJoAJqcbMcKYmI.jpg,109,5.3,6,1.106,Lee Yeon-woo,"송새벽, 라미란, 이범수, 이경영"
1024656,검정고무신: 즐거운 나의 집,검정고무신: 즐거운 나의 집,2022-10-06,짝사랑하는 여학생 숙이에게 잘 보이려다가 수업료를 모두 써버린 기철이는 생애 첫 아르바이트(?)를 시작한다. 뜻하지 않게 서울을 떠나게 된 기철이는 온갖 우여곡절에 휘말리게 되는데… 과연 기철이는 무사히 집으로 돌아올 수 있을까?,애니메이션,South Korea,"HyungSeul Networks, Saehan Productions",https://image.tmdb.org/t/p/w500/hk2BhjjKqYpLB4e9YVhzbC0gHcD.jpg,79,7.0,1,0.1164,Song Yo-han,"Park Ji-yoon, Oh In-sil, 박영재, Oh Su-gyeong"
1021869,유령의 해,유령의 해,2022-10-06,"한국 전쟁이 발발한 1950년대부터 1979년 10월 박정희 정권의 유신체제 철폐를 외쳤던 부마 항쟁까지, 한국의 현대사를 고스란히 살아온 인물들의 생을 과거와 현재가 혼재되는 방식으로 서술한다.",다큐멘터리,South Korea,,,125,0.0,0,0.141,Oh Min-wook,
